Source,Date,Title,Authors,Text,Keywords
fivethirtyeight,2016-02-22 20:48:12+00:00,Anthony Daviss 59/20 Game Was A Throwback To The 1960s,['Neil Paine'],"Games like the one Anthony Davis had Sunday night dont come along very often  at least not in the modern NBA.

With 59 points in the New Orleans Pelicans 111-106 win over the Detroit Pistons, Davis set new scoring highs for both his own career and the 2015-16 NBA season. He also pulled down a whopping 20 rebounds. Basketball-Reference.com doesnt have complete game-by-game rebounding records from before the 1983-84 season (more on that later), but since then, there have only been two other 50/20 games: a 2000 contest in which Shaquille ONeal scored 61 points and grabbed 23 boards against the Clippers and a 2001 tilt during which Chris Webber dropped 51 and 26 on the Pacers.

Daviss eye-popping numbers on Sunday came through incredible efficiency. His true shooting percentage in the game was 76.8, far above the leagues season-long average of 53.9. (By comparison, Webbers true shooting percentage was only 51.4 in his big game, and Shaqs was 68.3  outstanding, but below Daviss mark.) On the other hand, Daviss Pelicans also played a fast pace  100.2 possessions  compared with other big scoring/rebounding games from the recent past. So where does Davis rank if we account for both these factors?

To answer that, I grabbed game-level data from Basketball-Reference.com starting in 1983-84, and adjusted each players scoring and rebounding totals for the pace of the game, setting them all to a pace of exactly 100 team possessions per 48 minutes. I also adjusted for a players efficiency, giving his scoring tally an extra bump if he was more efficient than the league average. This is to account for games like Webbers that have impressive raw stats but required a large number of attempts. Finally, I took the geometric mean  a special average used when combining two numbers from different scales  of the players adjusted point and rebound totals, arriving at this list of the best scoring/rebounding games of the past 33 seasons:

UNADJUSTED ADJUSTED PLAYER DATE TEAM OPP PACE MIN PTS TS% REB PTS REB GEOMETRIC MEAN Shaquille ONeal 3/6/00 LAL LAC 95.6 45 61 68 23 70 24 40.9 Chris Webber 1/5/01 SAC IND 90.3 50 51 51 26 56 29 40.3 Michael Jordan 3/28/90 CHI CLE 95.6 50 69 73 18 80 19 38.7 Hakeem Olajuwon 5/14/87 HOU SEA 95.7 53 49 63 25 54 26 37.6 Charles Barkley 6/5/93 PHO SEA 93.4 46 44 74 24 52 26 36.6 Anthony Davis 2/21/16 NO DET 100.3 43 59 77 20 66 20 36.2 Shaquille ONeal 3/21/03 LAL BOS 91.1 39 48 74 20 58 22 35.8 Pau Gasol 1/10/15 CHI MIL 83.7 39 46 64 18 58 22 35.4 Shaquille ONeal 2/16/93 ORL DET 92.6 49 46 72 21 54 23 35.1 Carmelo Anthony 1/24/14 NY CHA 85.1 39 62 79 13 81 15 35.1 Charles Barkley 3/24/95 PHO HOU 87.6 42 34 67 26 41 30 35.1 Patrick Ewing 1/7/90 NYK LAC 92.2 48 44 66 22 51 24 34.9 Dwight Howard 1/12/12 ORL GSW 94.8 44 45 59 23 49 24 34.6 Dwight Howard 2/17/09 ORL CHA 88.2 47 45 73 19 56 22 34.6 Dwight Howard 4/16/11 ORL ATL 89.1 46 46 70 19 56 21 34.5 Zach Randolph 12/4/12 MEM PHO 88.1 44 38 74 22 47 25 34.4 Karl Malone 1/27/90 UTA MIL 104.0 33 61 84 18 68 17 34.2 Kevin Willis 4/13/93 ATL CLE 85.8 55 35 51 25 40 29 34.2 Hakeem Olajuwon 4/30/88 HOU DAL 98.1 43 41 62 26 44 27 34.1 Charles Barkley 12/9/87 PHI POR 93.2 42 38 72 24 45 26 33.9 Hakeem Olajuwon 3/14/89 HOU SAC 92.7 42 40 57 24 44 26 33.8 Dirk Nowitzki 12/2/04 DAL HOU 89.2 49 53 64 16 63 18 33.6 Al Jefferson 1/27/08 MIN NJ 85.4 42 40 70 19 51 22 33.5 Shaquille ONeal 6/6/01 LAL PHI 90.4 52 44 58 20 51 22 33.5 Shaquille ONeal 6/9/00 LAL IND 94.2 46 40 57 24 44 25 33.4 Charles Oakley 3/15/86 CHI MIL 91.1 44 35 57 26 39 29 33.4 The best scoring/rebounding games since 1983-84 Source: basketball-reference.com

After crunching the numbers, Daviss game slips to No. 6, behind not only ONeals and Webbers but also games from Hakeem Olajuwon, Charles Barkley and even Michael Jordan. (We dont tend to think of Jordan as a big rebounder, but he snagged 18 boards in his 69-point game against Cleveland in 1990.) Davis gets extra credit  about 7 points worth  for his efficiency but loses ground in the pace adjustment. A faster pace means more chances to score and snag rebounds, and Daviss game had about 7 percent more possessions than the average game above him on the list.

Of course, quibbling about where Daviss game ranks among the biggest scoring/rebounding performances in recent memory misses the bigger picture that games like Daviss (adjusted or no) are much more uncommon now than they were in the past. According to ESPNs Stats and Info crew, there were 36 games in NBA history (before Daviss on Sunday) featuring a player with a 59/20 stat line: the aforementioned Shaq game ... and 35 games from Elgin Baylor and Wilt Chamberlain, all before the mid-1970s. Chamberlain himself accounted for 33 of those games  17 of which came during his legendary 1961-62 season alone.

The simple truth is that outrageous single-game stat totals were a lot easier to come by in that era. The average pace factor for teams in 2015-16 is about 96 possessions per 48 minutes; the average in 1961-62, as best we can estimate it, was 126. In other words, compared with the modern game, that seasons players had over 31 percent more chances to score points and grab rebounds  59/20, for instance, becomes a mere 45/15 after adjusting away those extra possessions  and theres a good argument that rebounding numbers were inflated even further by the eras abysmally low field goal percentages (resulting in more missed shots to rebound). Theres a reason that Kevin Love in 2011 became the first player to average 20 points and 15 rebounds since 1983 and that 92 percent of the player-seasons meeting those criteria took place before 1976s NBA-ABA merger. The game was radically different back then, both on the court and in the stat sheets.

Thats why we should appreciate games like Daviss even more when they come along in todays NBA. Fifty-point, 20-rebound games have always represented special individual performances, but theyve become exponentially rarer these days, especially given recent changes to how the game is played. (Hello, Warriors!) So it might be a long time before you see another statistical game quite like the one Davis produced Sunday.","['24', 'daviss', '22', '44', '51', '26', '1960s', 'anthony', 'pace', 'game', '5920', 'throwback', 'games', 'average']"
fivethirtyeight,2016-02-23 16:00:23+00:00,Obama Will Have A Tough Time Rallying Support To Replace Scalia,['Anne Pluta'],"With the unexpected death of Supreme Court Justice Antonin Scalia, a new political battle looms for President Obama and the GOP-controlled Senate, which convened for the first time since Scalias death this week. Both sides have already exchanged barbs about the possibility of appointing a replacement in an election year. With Republican senators pledging publicly to block Obamas appointment, the president is likely to wage a battle for public opinion, hoping to rile the public up enough to pressure Republicans to vote on a nominee.

So what power does a president have to shape public opinion? Not a lot.

Samuel Kernell, a political scientist at the University of California, San Diego, coined the phrase going public in the 1980s to describe the process by which presidents take the legislative bargaining process outside of Washington and attempt to curry public opinion in an effort to pressure Congressional representatives to do the presidents bidding. Kernell viewed this as a negative development that precluded democratic deliberation and was the result of technological change and a weakening of the party system.

Though going public seemed to be an effective strategy, its efficacy wasnt explicitly tested until 2003, when Texas A&M political scientist George Edwards III found presidents have little ability to meaningfully change public opinion through outward appeals. Edwards pointed specifically to Ronald Reagans efforts on Nicaragua, Bill Clintons push on health care and George W. Bushs efforts on tax cuts, education and the Iraq War.

APPROVAL RATING PRESIDENT ISSUE DATES NO. OF REMARKS STARTING ENDING Clinton Health care March 93  June 94 445 71% 43% G. W. Bush Tax cuts Feb. 01  May 01 27 56 56 G. W. Bush War in Iraq Sept. 02  March 03* 140 58 59 Obama Health care Feb. 09  Feb. 10 332 46 49 When presidents try to rally public support *As soon as hostilities began, support rose to almost 70 percent. Source: Gallup, Health Affairs

In addition to the examples Edwards provided, more recent scholarship  on Obamas health care push and Bushs attempt to reform Social Security  confirms it is difficult for presidents to effectively change peoples minds.

Even though scholars generally agree the president cant directly do much to move public opinion, its possible to increase media coverage and the perceived importance of an issue. Two political scientists, North Texass Matthew Eshbaugh-Soha and Clemsons Jeffrey S. Peake, argue that in going public a president is really looking to raise the profile of an issue rather than necessarily change public opinion.

Would raising awareness help Obama get a Supreme Court nominee through the Senate? Its hard to say, but it would be more likely to work if the public already favored Obamas position, and thats not clear. As The Washington Post reports, at least four national polls have been conducted on whether Obama should appoint Scalias successor. Two polls found the public evenly split, 47-46 and 43-42, in Obamas favor. The other two polls found even larger shares supporting a 2016 appointment (54 percent and 62 percent), but, as The Post notes, those polls included wording that specifically laid out the underlying logic of both sides of the argument.

Perhaps those two more decisive polls are a truer reflection of where the public will stand in a few months, once both sides have been arguing their case awhile. In that scenario, raising awareness of the standoff might help Obama put pressure on the Senate (its another question entirely whether the Senate responds to that pressure). If the public remains evenly divided, however, the White House is more unlikely to benefit from highlighting the issue.

So why cant the president influence public opinion more? For one, hes not the only person or group making an appeal. Research specifically on the mechanics of going public about Supreme Court nominees finds that the president operates in an inherently competitive environment and that this competition structures the presidents approach. Charles Cameron and Jee-Kwang Park found that before 1965, presidents virtually never went public over Supreme Court nominees even when their nominees ran into trouble. Nomination hearings werent the norm until 1955, and Richard Nixon only went public once his nominees got in trouble. However, efforts became significantly more intense with Reagan. There are a few possible explanations for this change: Beginning with Sandra Day OConnor, Reagans first appointment in 1981, hearings were televised and the public was polled about the nominee. In addition, controversial decisions in the 1960s and 1970s  like those involving civil rights and abortion  may have made the Supreme Court a more important issue for the American public. Cameron and Park found presidents began to go public when and almost only when groups mobilized against the nominee. In our present-day scenario, interest groups are very likely to work against Obamas eventual nominee even if he nominates a moderate.

Were likely to end up with a battle along normal partisan lines, and most research suggests that if the fate of the nominee rests on Obamas bully pulpit, the chances of confirmation are low.

Listen to the latest episode of the FiveThirtyEight Elections podcast.

Subscribe: iTunes | Download | RSS | Video","['supreme', 'obamas', 'tough', 'nominee', 'presidents', 'support', 'polls', 'replace', 'health', 'rallying', 'opinion', 'scalia', 'president', 'public', 'obama']"
fivethirtyeight,2016-02-22 17:46:10+00:00,Does Leonardo DiCaprio Deserve An Oscar? An Interrogation.,['Walt Hickey'],"Leonardo DiCaprio is probably going to win an Academy Award, his first, for his role as Hugh Glass in The Revenant. Our model tracking the race has him as an obscene favorite, every gambler this side of Dublin has him as the prohibitive leader, and nearly all the amateur modelers weve followed throughout awards season project him to be the winner. Barring a meteor strike, or some hostage-taking by Michael Fassbender, its gonna be Leo.

And were you to talk to a DiCaprio fan, its about time! The narrative being bandied about is that regardless of how you feel about his stint in The Revenant, DiCaprio deserves an Oscar. Weve read about how he and the crew of The Revenant were very cold during filming and how perhaps this might be a good argument for an Oscar win. It has been mentioned that DiCaprio was nominated four  four!  times previously and was arguably snubbed each time (for your pleasure, Ive sprinkled clips of DiCaprios snubs throughout this piece).

But heres an exercise: Make a mental list of four films that you think DiCaprio could have earned an Oscar nomination for. Mine, for example, would be Gangs of New York, Catch Me If You Can, The Departed and Inception. But go ahead and compare those to the films he was actually nominated for: Whats Eating Gilbert Grape, The Aviator, Blood Diamond, and The Wolf of Wall Street. I remember nothing from Blood Diamond. Do you?

Still, the narrative is what it is, so its time to answer the immortal question: Does DiCaprio deserve an Academy Award?

Interactive: Our elections-style Oscar model looks at the predictive power of film awards over the past 25 years and tracks this years nominees and winners to try to gauge the race in the big six Academy Award categories. See the state of the Oscars race 

First, lets check out his credentials. We want to know, essentially, how many good movies DiCaprio has made and how they stack up against the pre-Oscar resumes of those who have been honored with a top acting prize. We can do this by simply counting up films with high ratings on Rotten Tomatoes, but we can also take it a step further and see how that figure translates to an annualized rate.

Last week, I analyzed who had the best and worst careers after winning a best actor or best actress award. For that analysis, I studied actors and actresses who have won best actor and actress Oscars since 1970, for a total data set of 45 actor wins and 45 actress wins. Although that analysis pertained to post-Oscar work, it was just as easy to pull the Rotten Tomatoes scores for each performers pre-Oscar films. For todays analysis, I tallied how many rated films those performers were in before winning an Oscar, how many of those films received ratings of at least 50 percent, 75 percent or 90 percent on the Tomatometer, and how long the performers worked before their Oscar win. Where does DiCaprio land?

Well, hes qualified, but its not like hes the most qualified ever. DiCaprio has appeared in 37 films over 24 years, 21 of which were rated 50 percent or higher, 14 of those were rated 75 percent or higher, and two were rated 90 or higher. Not unimpressive by any means!

PERFORMER OSCAR WIN YEARS BETWEEN 75%+ FILMS 1 Emma Thompson 1992 0.8 2 Diane Keaton 1977 0.9 3 Meryl Streep 1982 1.0 3 Sean Penn 2008 1.0 3 Philip Seymour Hoffman 2005 1.0 3 Jean Dujardin 2011 1.0 3 Louise Fletcher 1975 1.0 8 Jack Nicholson 1975 1.1 8 Sean Penn 2003 1.1 10 Gene Hackman 1971 1.2 10 Robert Duvall 1983 1.2 ... 32 Marlon Brando 1972 1.7 33 Robert De Niro 1980 1.7 33 Leonardo DiCaprio  1.7 35 Susan Sarandon 1995 1.8 36 Matthew McConaughey 2013 1.8 ... Best actor and best actress resumes before Oscar win

Through 2015, DiCaprio has made a movie rated 75 percent or higher about once every 20 months, the same rate as Robert De Niro when he won the 1980 best actor Oscar for Raging Bull. But DiCaprio rates only a hair better than Matthew McConaughey did when McConaughey won the 2013 best actor award. If DiCaprio wins this year, hell be tied for the 33rd-most-successful pre-Oscar career of the 90 winners we tracked (plus DiCaprio).

On the other hand, DiCaprio would be one of the worst in the set if we were focusing on how often actors appeared in truly great films, the ones rated 90 percent or higher. With two films rated 90 or higher over a 24-year career, hed be in 63rd place, tied with the careers of Kathy Bates before her 1990 win and Julia Roberts before her 2000 win.

Still, based on the data, DiCaprios career certainly looks like the careers of other Oscar winners.

So lets concede that DiCaprio deserves an Oscar based on his career thus far. That raises the question: Who else deserves one?

A crapload of people is who. A big part of Camp DiCaprios argument is that hes been nominated multiple times before this year and lost each time, so it seems that his supporters believe multiple unfulfilled nominations constitute a debt that can only be settled with a future victory.

In Oscar history there are 51 performers, DiCaprio included, who have been nominated three times or more for an Academy Award in the acting categories yet have never won. Of those 51 performers, 28 are still alive.

I pulled the data on these 28 performers from Rotten Tomatoes to find out how often they acted in movies rated 75 percent and up and 90 percent and up.

Thirteen of the 28 performers have matched or beaten DiCaprios 14 films rated 75 percent or higher. And 23 of them have bested DiCaprio in the 90 percent category, having made three or more such highly-regarded films.

Lets not be reckless, though: Leo is a young man. Some of these performers have been at it for decades. Lets normalize things to a rate of films per year.

By my reckoning, 22 living actors at minimum can claim they deserve an Oscar more than DiCaprio, by one methodology or another. Twenty-two performers who were nominated three times or more have acted in films rated 90 percent or higher more often than Leo. Eight of those performers have also acted in films rated 75 percent or higher more often than Leo. Those actors are bolded in the table.

AVG. YEARS BETWEEN ... PERFORMER ACTING NOMINATIONS 75%+ RATED FILMS 90%+ RATED FILMS Matt Damon 3 1.0 2.3 Amy Adams 5 1.3 2.5 Laura Linney 3 1.6 2.6 Mark Ruffalo 3 1.6 3.2 Ed Harris 4 1.4 3.4 Sigourney Weaver 3 1.9 4.2 Tom Cruise 3 1.9 4.3 Kirk Douglas 3 2.6 4.6 Bradley Cooper 3 2.0 4.7 Glenn Close 6 1.7 4.7 Johnny Depp 3 1.3 5.2 Albert Finney 5 2.3 5.2 Annette Bening 4 2.1 5.4 Joan Allen 3 2.1 6.0 Edward Norton 3 1.7 6.3 Brad Pitt 3 1.4 6.5 Michelle Williams 3 1.8 7.0 Nick Nolte 3 1.7 7.6 Michelle Pfeiffer 3 3.0 8.3 Warren Beatty 4 3.9 8.5 Angela Lansbury 3 3.7 8.9 Joaquin Phoenix 3 2.9 9.7 Leonardo DiCaprio 5 1.7 12.0 Who deserves an Oscar more than Leo? Source: ROTTEN TOMATOES

And thats a partial list! You could make a lot of arguments about actors outside of this set who probably deserve Oscars based on their past work. For example, Ian McKellen  who lost the 1998 best actor award to Roberto Benigni and the 2001 best supporting actor award to Jim Broadbent  has had a legendary career, but nobodys talking about a snub for him in Mr. Holmes.

But heres whats absolutely crazy about this year and the narrative thats built up around the best actor race. Lets say DiCaprio deserves an Oscar. You know who deserves one more? Matt Damon, a guy whos also nominated for best actor this year!

Not only is DiCaprio not the actor most overdue for an Oscar, hes not even the most overdue among this years nominees.

Sure, DiCaprio is essentially a lock to win. But when the statues are allocated and the afterparty is over, DiCaprio better send his press people a mighty gift basket for making this narrative happen. And Damon should probably make some phone calls inquiring about how to get a convincing bear on Mars for the sequel, The Martian II: When Science Went Too Far.","['rated', 'performers', 'deserve', 'dicaprio', 'actor', 'interrogation', '75', 'does', 'oscar', 'films', '90', 'leonardo', 'best', 'higher']"
