Source,Date,Title,Authors,Text,Keywords
fivethirtyeight,2016-02-18 18:08:30+00:00,What Happens Now That We Know Gravitational Waves Are Real?,[],"Last week, physics had a rare moment in the headlines after scientists announced they had made the first direct observations of gravitational waves, ripples in the fabric of spacetime predicted by Albert Einsteins theory of general relativity. It was an astounding technological and scientific feat, decades in the making. Taking a page from our colleagues on the politics desk, who gather round to chat regularly, we asked some of our favorite astrophysicist-types to join us for a chat about the waves, what they mean for science, and what may come next.

Our participants:

Christie Aschwanden: Lead science writer at FiveThirtyEight.

Lead science writer at FiveThirtyEight. Alan Lightman: Physicist, novelist and professor of the practice of the humanities at the Massachusetts Institute of Technology. His most recent book on science is The Accidental Universe.

Physicist, novelist and professor of the practice of the humanities at the Massachusetts Institute of Technology. His most recent book on science is The Accidental Universe. Katie Mack: Theoretical astrophysicist at the University of Melbourne, researching dark matter, particle physics and the early universe.

Theoretical astrophysicist at the University of Melbourne, researching dark matter, particle physics and the early universe. Derek van Westrum: Physicist with NOAAs National Geodetic Survey, specializing in terrestrial gravity measurements and their applications.

Christie: The big gravitational wave announcement happened about a week ago now, and the hoopla has mostly died down. Ive gathered you all here today to discuss whats next. How does this discovery frame our thinking about the universe? And where will it take us? What can we do now that we couldnt do before?

Alan: No one doubted the existence of gravitational waves. We absolutely but indirectly inferred their existence with the binary pulsar a couple of decades ago.

Katie: And that won a Nobel Prize!

Alan: Yes, the new discovery  the direct detection  will also win a Nobel, probably for Thorne, Weiss and Drever. [Thats Kip Thorne, Rainer Weiss, and Ronald Drever, the founders of the Laser Interferometer Gravitational-wave Observatory (LIGO) that detected the waves.]

Christie: So given that this is anything but a surprise, what makes it such a big deal? And, maybe what Id like to know even more: Why has this captured our imagination?

Derek: I think its literally a whole new kind of telescope. We can see (or maybe hear is better) things that were invisible before.

Alan: Better to use hear than see because this is not electromagnetic radiation, like light and X-rays. It is the vibrations of space, more like sound waves.

Katie: I think that the discovery, as a discovery, is immensely exciting. But the part that makes this thing game-changing and truly revolutionary is that its the start of gravitational wave astronomy. An entirely new field!

Christie: So a new tool AND a new field!

Katie: Yes, absolutely.

Alan: Its a big deal for at least two reasons. As Derek says, it is a new kind of telescope. But also, it is a triumph of technology. It is the most sensitive instrument ever created by humankind. We will be able to see things we couldnt see before  like oscillating black holes, quiet supernova, lumps in the early universe.

Katie: Up until now, weve been able to observe the universe with light and with certain kinds of cosmic particles. But this is fundamentally different  were looking at spacetime itself.

Derek: As an instrumentalist myself, that was the truly astonishing part. That this thing remotely worked! Its incredible technology.

Katie: Yeah, the technological achievement is mind-blowing. I also love how much just came together perfectly for this. Until a decade or so ago, we didnt have reliable simulations of black hole collisions. People had tried to get black holes to merge in numerical simulations and had to fudge something or the code would break. It was only in something like 2005 that a simulation was really successful, and what LIGO saw was pretty much exactly what the simulations predicted.

Alan: That was only a problem with the simulations, We knew that black holes would have to spiral in and merge.

Christie: I love the idea that we can use this to hear the early universe.

Derek: So Ill let you both go for it on the astronomy side of things, but there is a separate chapter to Christies question: Are there important outcomes of this closer to home?

Alan: Closer to home might be a matter of coaxing the National Science Foundation and the National Institutes of Health to fund long-term projects without immediate payoff.

Derek: I would just add, as a taxpayer, I would pay cold, hard cash to know that the equivalent of three solar masses disappeared into gravity waves, and that was brighter than the visible universe. Incredible. But, that may just be me.

Alan: I wish all taxpayers were like you.

Christie: Me too!

Katie: Im not sure how universal that is, but I definitely think there will be spinoffs to both the technology and the discovery itself that will have benefits we cant even imagine yet.

Alan: Certainly to the technology. But I dont think we need spinoffs to justify this. It is the same as justifying ballet.

Katie: I dont need spinoffs to justify this, but it doesnt hurt to point out to taxpayers that fundamental physics leading to new technology is a long and proven tradition!

Derek: Thats what I found so interesting about this particular announcement: Its mind-blowing in itself, but if you wanted to justify it in terms of an investment, there really are things we can point to in the sensors that will have great payoffs. In manufacturing, for example.

Christie: Ive noticed that gravitational waves seem to have captured the publics imagination in a way that many basic science discoveries dont. Do any of you have theories as to why?

Alan: For one thing, people love black holes, like dinosaurs. Also, the scientists were very very media savvy and orchestrated this with the press for months in advance.

Katie: I think a lot of people are picking up on how excited the physicists are, so that might be part of it. (I mean everyone I know who is involved in this stuff is positively giddy.) But also, people love black holes. And spacetime.

Derek: And they made it audible!

Katie: *chirp!*

Alan: Yep. But when we detect much bigger black holes, they wont be audible.

Christie: Yeah, I couldnt stop listening to the chirps!

Derek: I still like to think of them like whale songs ...

Katie: One of the things that makes this exciting for me is that its evidence of a massively violent event in the distant universe, but were not just seeing some vague image in the telescope. The instrument is actually being deformed by the gravitational waves. This is gravity coming to your house and moving your stuff.

Alan: Everything about this discovery is theatrical: 40 years in the making, generations of grad students, two 2.5-mile long tubes, black holes, audible signal.

Christie: Alan, do you think theres a novel in here?

Alan: There is certainly a movie in this. Janna Levin is about to come out with a nonfiction book on LIGO, where she interviewed all of the principals.

Derek: And Alan  it comes ~exactly 100 years after Einstein thought of it

Alan: Yes, thats another part of the theater. It was made for Hollywood, but its serious stuff.

Katie: Everybody loves a story about Einstein being a genius.

Christie: Einstein had some uncertainty about gravitational waves, right?

Alan: Yes, he did. He thought that the wiggles might be wiggles of the coordinate lines, like wiggling latitude lines on a globe, rather than real wiggles in space.

Christie: Does this feel like a moment that will give physics some propulsion in the coming years? Not just for those in the field, but in the publics mind? Do you expect this success will make it easier to get funding for the next big project?

Derek: I think this gets back to justifying the ballet.

Christie: Yeah, we shouldnt have to! But the reality is, we do.

Katie: I think this will definitely give the LISA project some propulsion. (Possibly literally.)

Derek: The thing that it isnt obvious at first is that this project is actually relatively easy to point to as an investment: The techniques with quartz fibers and interferometers will be very useful in all types of manufacturing. And talk about delayed payoff: 100 years after general relativity was invented, there are practical uses for it.

Katie: There are lots of examples of delayed payoffs from obscure fundamental physics. Antimatter has led to PET scans, quantum tunnelling to certain kinds of transistors, etc.

Alan: Yes. The history of science is full of pure ideas and discoveries that then turned out to have practical application.

Derek: Just imagine if LIGO never worked! *gulp*

Alan: Robert A. Heinlein wrote a book about a society that prided itself in funding projects that wouldnt succeed for 100 years. Unfortunately, the society kept messing up, and the wild-idea projects had practical applications within a few years.

Derek: That is worth a try

Christie: Last year I wrote about this theory of creativity that says that following interesting ideas and seeing where they lead you results in bigger payoffs than working toward a concrete goal. Seems true of science too.

Alan: That to me is a big implication here. Our national funding agencies, like NSF, NIH, etc., need to put money into pure research even if they cannot see an immediate payoff.

Katie: Yes, thats hugely important. Its easier to think outside the box if you ignore the box entirely.

Alan: Actually, gravitational waves, among all other waves, can penetrate the box, any box.

Christie: Yeah, this looks like a brilliant example of the payoffs of basic research, which you can never predict in advance.

Derek: Im with you, but as devils advocate: If LIGO was just a continuous disaster, never producing results, wed be having a different conversation right now, for sure.

Alan: I dont think LIGO could have been a continuous disaster. We knew from theoretical calculation the likely sources of gravitational waves, the likely strengths, and we knew how sensitive the device had to be. We slowly but steadily worked towards that sensitivity.

Its not like when we searched for the decay of the proton, where we werent sure of the underlying theory.

Christie: I wonder though if it would be helpful to science if funders could embrace failure a little more. Sometimes its the best teacher.

Alan: Totally agreed. You have to risk failure to get results, certainly results like this one. There is a saying in Bridge, the card game: If you dont lose half your slam bids, you are not bidding them often enough.

Derek: Thats a good point, and Id say it speaks to the quality of the funding agencies: They seem to be able to recognize a plausible, even if difficult, idea. At least thats my impression. It sounds like maybe you think they could be more daring?

Christie: So, Alan, how could funders adopt an approach thats not afraid to fail?

Alan: Well, none of us are saying that funders should support failure. But we are saying that funders should take some chances on longer bets and not always be looking for quick payoffs. Funders should support very solid and dedicated scientists who they trust, like Thorne, Weiss and Drever.

Derek: Id add that sometimes, if its reasonable, you can try things where you expect one outcome, but another would open lots of new science. The ether is the classic example: They all expected it to be there, and when it wasnt, voila! Way more interesting stuff ...

Katie: Funders should also support new investigators and new ideas, though. Cant always be just the top established people. Theres a lot to be said for funding experiments based on expected value, right? High risk but high reward experiments are just as important as stuff thats almost certain to pay off but isnt revolutionary.

Christie: Katie, do you think this could inspire a new wave of physicists?

Katie: I definitely think young people will be inspired by this. Black holes and warped spacetime were the kinds of things that got me excited as a kid.

Alan: The astonishing thing is that the physical event was so clean. Two black holes spiraling into each other is far neater and more predictable than a black hole and a neutron star, for example.

Derek: Were there other, messier events that probably generated gravitational waves, but we just cant tell? What are the chances that the first was so perfect? And from a direction where the Louisiana detector could so clearly hear it first.

Alan: I believe that LIGO has been picking up other, smaller and messier events. Nothing is as clean as two black holes spiraling into each other. You dont have to know anything about the crust of a neutron star, etc.

Christie: So were running out of time. Shall we wrap up with a few final thoughts?

Alan: Its a great day for science, and the human civilization that has produced our science.

Derek: Agreed  this is an amazing achievement that is beautiful, interesting and will surely lead to things we cant imagine now.

Katie: Its the start of a whole new era  a new branch of astronomy! (Ive been saying that a lot over the past few days, but its not at all an exaggeration.)

Alan: We are back in the time of Galileo, but looking forward.

Christie: Thanks so much for your time, all. It was a delight to have you here.

Alan: Until the next black hole collision!",[]
fivethirtyeight,2016-02-18 21:17:42+00:00,The Pope Is Way More Popular Than Donald Trump,"['Leah Libresco', 'Nate Silver']","Donald Trump took a break from threatening to sue rival candidates on Thursday and appears to be trying to start a holy war with Pope Francis instead. Trump may not care about any resulting eternal judgment, but he might have reason to worry about worldly opinion: Pope Francis has a net +53 favorability rating among Americans, while Trump has a net -27 favorability rating.

True, Pope Francis is somewhat less popular with Republicans than among Americans overall. But hes still reasonably well-liked. In a CNN poll in September, 56 percent of Republicans had a favorable view of Pope Francis as compared to 21 percent with an unfavorable one. Francis had +20 net favorability rating even among self-described tea-party supporters.

For once, this is a fight that Trump didnt start. Reporters asked Pope Francis, during one of the informal press conferences held on the papal plane what he thought of Trumps position on building a wall at the U.S.-Mexico border. The pope said that he wasnt familiar with Trumps position, but added, I say only that this man is not Christian if he has said things like that.

The majority of conservative Catholics would probably agree with that assessment of Trumps faith. According to a survey conducted in January by the Pew Research Center, just under half (49 percent) of Catholics who are Republicans or lean toward the GOP said that Trump was not very or not at all religious. That was the highest level of skepticism expressed by any of the denominations Pew surveyed. (White mainline Protestants were most likely to give Trump the benefit of the doubt; 35 percent judged him to be not very or not at all religious.)

However, a sizable share of Catholics are open to seeing Trump in the White House, even if they dont expect to see him in a pew. In Pews survey, 30 percent of all Catholics who are registered to vote said they felt that Trump would be a good or great president. Thats pretty much on par with registered voters in general (31 percent). In other words, Catholics are swing voters. In 2012, Catholics gave 50 percent of their votes to Barack Obama and 48 percent to Mitt Romney, according to the national exit poll.

Trump doesnt need to worry as much about winning over Catholics in coming weeks. The next set of GOP primaries doesnt occur in heavily Catholic states. Super Tuesdays contests on March 1 will include Massachusetts, where Catholics made up 51 percent of Republican voters in 2008, but most of the upcoming states are in the South, where few Catholics reside.

STATE WINNER AMONG CATHOLICS (2008) CATHOLIC SHARE OF GOP ELECTORATE (2008) New Jersey McCain 57% Massachusetts Romney 51 New York McCain 46 Connecticut McCain 45 Wisconsin McCain 39 New Hampshire McCain/Romney tie 38 Vermont McCain 35 Maryland McCain 33 Louisiana McCain 32 Illinois McCain 31 Florida McCain 30 Michigan Romney 29 Delaware McCain 28 Ohio McCain 26 California McCain 25 Missouri McCain 20 Arizona McCain 20 Virginia McCain 19 Nevada Romney 18 Texas McCain 16 South Carolina McCain 13 Oklahoma ** 11 Georgia Romney 11 Mississippi ** 9 Tennessee McCain 6 Arkansas ** 6 Alabama ** 5 Utah ** 3 Where are the Republican Catholics? ** Sample size too small to reliably determine winner among Catholics Source: Edison/Mitofsky National Election Pool Exit Polls, 2008

But although the Catholic-heavy states fall later, they could prove important to the delegate math. Many of their delegates are awarded on a winner-take-most (as in New York, where 46 percent of the Republican electorate was Catholic in 2008) or winner-take-all (as in New Jersey, Wisconsin and Pennsylvania) basis. So if Trump doubles down on his fight with the pope, he could wind up paying a price as he seeks to expand his coalition beyond his enthusiastic base  particularly given that he may already have a relatively low ceiling on his support. In 2008, another competitive primary (and one with more comprehensive exit polling than 2012), Catholics were an important part of John McCains coalition, and theyre a group that a candidate like Marco Rubio (who is Catholic) or John Kasich could come to rely upon this year.

Plus its just plain inaccurate to complain, as Trump did, that for a religious leader to question a persons faith is disgraceful. For someone whose titles include Vicar of Jesus Christ and Successor of the Prince of the Apostles, questioning and clarifying other peoples faith is pretty much the job description.",[]
fivethirtyeight,2014-03-17 19:50:22+00:00,"Fear Not, Readers: We Have RSS Feeds",['Carla Correa'],"Update (March 28): Our readers have spoken, and we listened. We now have a catch-all RSS feed: http://fivethirtyeight.com/all/feed. This feed will deliver all FiveThirtyEight content.

The much-decried shutdown of Google Reader last summer didnt end the demand for RSS aggregation  especially among our core audience. Soon after the relaunch of FiveThirtyEight on Monday, tweets rolled in asking about RSS/ATOM feeds. Among them:

Love the new @FiveThirtyEight except for its apparent lack of a functioning RSS feed. :( http://t.co/awsuPTbm5L  Chad Skelton (@chadskelton) March 17, 2014

To help out sad Chad and his fellow FiveThirtyEight readers, heres a handy list of RSS feeds:

Features: http://fivethirtyeight.com/features/feed/

DataLab posts: http://fivethirtyeight.com/datalab/feed/

Politics features: http://fivethirtyeight.com/politics/feed/

Economics features: http://fivethirtyeight.com/economics/feed/

Sports features: http://fivethirtyeight.com/sports/feed/

Science features: http://fivethirtyeight.com/science/feed/

Life features: http://fivethirtyeight.com/life/feed/

Nate Silvers posts: http://fivethirtyeight.com/contributors/nate-silver/feed/

Note: The same format as Nates feed (first name-last name in the URL) can be used for all other FiveThirtyEight contributors.

Need an RSS reader? I like the smartphone- and tablet-friendly Feedly.",[]
fivethirtyeight,2016-02-19 20:26:15+00:00,Everyone Still Reads To Kill A Mockingbird,['Hayley Munguia'],"On Friday, the mayors office in Monroeville, Alabama, announced that Harper Lee, author of the 1960 Pulitzer Prize-winning novel To Kill a Mockingbird and its controversy-plagued 2015 sequel Go Set A Watchman, had died at age 89. A look at the numbers behind Lees greatest work bear out its prominent place in American culture.

In 2012, the Fordham Institute, an education policy think tank, surveyed 484 high school English teachers about which books they assigned. According to the groups study, Mockingbird was taught by more ninth- and 10th-grade teachers  35 percent of them  than any other book of fiction listed. It also tops most works in other categories, including poetry and plays. Mockingbird beats the most-taught works of Mark Twain, Shakespeare or John Steinbeck. The only reading material that topped it was Martin Luther King Jr.s I Have A Dream speech, which was taught by 38 percent of teachers in those grades.

The book is also widely taught on college campuses. According to the Open Syllabus Project, which tracks books that are listed on more than a million college syllabi nationwide, To Kill a Mockingbird was assigned 633 times, making it the 255th-most-assigned book in the database  an impressive rank, considering that the vast majority of the titles are either textbooks or predate the 20th century. (Of the top 10 books, only two  E.B. White and William Strunk Jr.s The Elements of Style and Neil Campbells textbook Biology  were published after 1850.)

In terms of determining where To Kill a Mockingbird stands among similar texts, the Open Syllabus Project also has data on which books are the most likely to be assigned together in college, which could be a somewhat more useful proxy for comparing books that contributed to American culture in the same way. To Kill a Mockingbird was most likely to be assigned along with J.D. Salingers The Catcher in the Rye, William Goldings Lord of the Flies, F. Scott Fitzgeralds The Great Gatsby and George Orwells Animal Farm.

To get a sense of how popular these books are beyond college classrooms, Goodreads is the place to go. Of the five books listed above, To Kill a Mockingbird has both the highest number of ratings and the highest average rating, 4.23 out of 5 stars.

But even though theres a pretty established consensus that its a great book (though there are dissenting opinions), Google search data shows that we probably cant separate it  or any of the books associated with it  from the classroom.

The seasonality of the search data hints at the link between the books popularity and their use in the classroom. Most searches for the five books take place around May every year, presumably when students are studying for finals or writing essays. Theres also a similar, albeit smaller, uptick around November or December every year  another indicator of cramming for midterms or finals.

The May 2013 spike in searches for The Great Gatsby is no doubt tied to the release of Baz Luhrmanns film adaptation. But even with that factored in, To Kill a Mockingbird still wins the search game over time; until 2012, Lees novel was the most-searched of the five, and on average since 2004, its still been searched about 10 percent more often than Fitzgeralds.

The data on Lees influence is clear, but it really just tells us what we already know: By grappling with racial injustice in American society  an issue that we still struggle with  Harper Lees work endures, and will continue to do so for many years to come.",[]
