Source,Date,Title,Authors,Text,Keywords
fivethirtyeight,2016-02-18 16:08:24+00:00,Why Its So Hard To Prove Zika Is Causing Birth Defects,['Christie Aschwanden'],"For weeks, Zika virus has been all over the news. Stark photos of babies with microcephaly, a birth defect in which the infants head is abnormally small and its brain often not fully developed, have accompanied stories about the ongoing spread of Zika across more than 20 countries. Several Latin American countries have advised women (many of whom lack access to reliable birth control) to avoid pregnancy for the time being, and the Centers for Disease Control and Prevention has recommended that pregnant women avoid traveling to countries with the Zika virus if they can. These scary bulletins can overshadow an important fact: The Zika virus has not yet been proven to cause microcephaly.

The proposed link between Zika and microcephaly began taking shape in September after some pediatricians in northeast Brazil noticed an unusual number of babies born with microcephaly. This spike in microcephaly cases coincided with an outbreak of Zika, a virus related to the dengue virus and spread by mosquitoes, and when a task force set up a registry to track the problem, it discovered that in 26 of the first 35 cases entered, the mother had developed an illness with a rash potentially indicative of Zika during her pregnancy.

Given the apparent overlap between microcephaly and Zika virus, The first impression is that theres a relationship one to the other, said Denise Cavalcanti, a geneticist at the State University of Campinas in Campinas, Brazil. First impressions can sometimes deceive, though, and she said the evidence linking the two is circumstantial and not yet confirmed. We should prove this scientifically.

But confirming a link between Zika and microcephaly will take more research and time  months, if not years  and the confirmation may end up as a preponderance of evidence rather than a definitive link. Whats easy to forget about the oft-cited scientific mantra, correlation is not causation, is that causation is incredibly difficult to prove. When youre a doctor whos seeing an alarming number of infants born with birth defects, correlation may be all you have to go on. If youre a public health official with the job of protecting your community from a scary new threat, you cant always wait for certainty before you act. And that means you must give advice based on the imperfect evidence you have, rather than the definitive data you wish you had.

The evidence available at the moment led experts at the World Health Organization to conclude that a causal relationship between Zika infection during pregnancy and microcephaly is strongly suspected, though not yet scientifically proven. Which is why, as my colleague Anna Maria Barry-Jester explained on FiveThirtyEight recently, the WHOs declaration of a public health emergency of international concern referred to the cluster of birth defects and a potentially paralyzing condition called Guillain-Barre syndrome, not the Zika virus itself. Sometimes lost amid the worry is the fact that Zika produces relatively minor symptoms, and only in about 20 percent of people infected. And at the moment, theres no quick and easy test for Zika that can be used outside a research setting.

The evidence connecting Zika and microcephaly remains circumstantial, but its growing. Theres not going to be any single perfect piece of data to link Zika to microcephaly, said Melinda Moore, a pediatrician at the RAND Corp. who previously studied infectious diseases at the CDC. Instead, researchers must piece together multiple lines of imperfect evidence to come up with a clear picture.

But efforts to construct that clear picture face some major challenges. As Brazilian pediatrician Sandra da Silva Mattos and her colleagues recently wrote in the Bulletin of the World Health Organization, The first question to be addressed is the real incidence of microcephaly in Northeast Brazil. Before scientists can confirm that Zika is causing microcephaly, they need to know how common microcephaly was before Zika and how widespread it is now. Right now, the answer to both of those questions remains muddy.

In search of numbers, da Silva Mattoss group put together a local task force to go back and look for microcephaly in a database of newborns in northeast Brazil born mostly before the current outbreak. They found that the incidence of microcephaly in the area was much higher than expected  from 2 percent to 8 percent, depending on which criteria were used for diagnosis (more on that in a minute). However, when they reviewed only extreme cases, the incidence fell in the range of 0.02 percent to 0.19 percent, which is in line with the incidences reported for microcephaly in other parts of the world. They also found that microcephaly cases varied seasonally, in a pattern that could reflect the peak activity of mosquitoes that carry Zika.

But heres the puzzle: This fluctuation was seen as far back as late 2012, several years before Zika is known to have appeared in Brazil in mid-2014. In fact, cases of microcephaly seem to have peaked early in 2014, before Zikas appearance in Brazil, most likely during a sporting event, later that year. This finding could suggest another cause, or it could mean that Zika entered this area earlier than was previously known. Its important to note that da Silva Mattoss review is a preliminary report.

What first looked like a startling epidemic of microcephaly cases could turn out to be, at least in part, an example of the awareness effect  an uptick in cases that happens when increased awareness of a problem leads to the identification (or, in some cases, misidentification) of cases that otherwise would have gone undetected. Microcephaly was probably underreported before Zika, and Jorge Lopez-Camelo and Ieda Maria Orioli from the Latin American Collaborative Study of Congenital Malformations note in a report they had translated into English for Nature that Brazils Live Birth Information System recorded only about a third as many birth defect cases as would be expected based on incidence in other parts of the world. Unless the area had an unusually low baseline rate of birth defects, any new effort to look for a specific defect could easily result in a two-thirds increase in numbers, simply by finding cases that would otherwise have gone uncounted.

Some of the confusion may come down to how microcephaly is classified and counted. A commentary published in the Lancet this month describes how different standards for diagnosing microcephaly can drastically alter how many cases are found. Under criteria in use by Brazils Ministry of Health up to Dec. 8, northeast Brazil (where the problem is thought to be most severe) would have had an estimated 158,000 suspected cases. But the standard adopted by the ministry on Dec. 8 reduced that estimate to 46,000  less than a third of what it was previously  simply by setting the cutoff for microcephaly at a head circumference further from the norm.

In other words, the newer standard allowed for more natural variation. Its not the head size but the brain and its development that matter here, and some babies can have smallish heads and still have normally developing brains. (The earlier standard found more cases but would have had more than three times the false-positive rate, meaning that it would label lots of healthy babies as having microcephaly.) The Pan American Health Organization uses an even more stringent cutoff, which would estimate 29,000 cases in this part of Brazil.

None of this means cases of microcephaly arent increasing, but the uptick doesnt appear to be as drastic as first reported. According to an update published on Wednesday by the Brazilian Health Ministry, there are currently 5,280 suspected cases of microcephaly or other central nervous system problems. Of these, 3,935 are still being investigated, 837 have been discarded as something else and 508 have been confirmed.

While the case numbers are sorted out, researchers are gathering and assessing evidence regarding Zika and microcephaly. The Pan American Health Organization reported in December that Zika virus had been identified in the amniotic fluid of two pregnant women whose fetuses had been diagnosed with microcephaly, and scientists also found RNA from the Zika virus in the brain of an infant with microcephaly who had died shortly after birth. A recent case report published in the New England Journal of Medicine described a European woman who developed symptoms of Zika while living in Brazil during the first trimester of a pregnancy. She went to Europe for the latter part of her pregnancy, and after an ultrasound revealed severe microcephaly, the pregnancy was terminated. Tests on the fetus showed Zika virus in the brain tissue. The finding of Zika in babies is compelling, but its still possible that its an incidental finding.

Zika would not be the first virus to lead to microcephaly  rubella can also cause the condition  but it would be the first virus of its kind known to trigger it. Other flaviviruses, such as dengue and West Nile, are not known to cause microcephaly, and thats perplexing, said Moore, the RAND pediatrician. There are plenty of other viruses in this family, and none of them cause this.

If the link between Zika and microcephaly is real, and the experts I talked with suspect that it is, then one outstanding question is why microcephaly hasnt been seen in other areas where Zika outbreaks have occurred. The virus was discovered in 1947 in the Zika forest of Uganda, and it has also appeared in Southeast Asia and French Polynesia.

Eskild Petersen, an expert in vaccines and infectious diseases at Aarhus University in Denmark, has posed this question to colleagues in Southeast Asia, and their answer was that the surveillance system was really poor. Its a problem thats common across areas that have experienced Zika.

In French Polynesia, an outbreak of Zika in 2013 and 2014 was not associated with microcephaly at the time, but when researchers went back later to look, they found 17 potential cases. Microcephaly thought to be linked to Zika still hasnt been seen in Brazils neighbor Colombia, which also is experiencing an outbreak, although its possible that most babies in Colombia whose mothers have been exposed to Zika havent been born yet.

Whats needed now are rigorous case-control studies (some of which are underway) of otherwise similar women whose babies had or didnt have microcephaly. That could help explain why some babies developed the condition and others didnt, Moore said. The good studies now underway will hopefully help nail down whether [the link between Zika and microcephaly] is strong, weak or non-existent, she said. There are numerous other possible explanations for the cases seen in northeast Brazil, including malnutrition, environmental factors or other viruses, and these have not yet been fully explored.

Even if Zika isnt causing new cases of microcephaly, were going to need science to help us understand what is. If there really is an uptick in microcephaly cases and they are not the result of Zika, then prematurely pinning them on the virus could obscure the true cause and stand in the way of doing something about it.

Anna Maria Barry-Jester contributed reporting.",[]
fivethirtyeight,2016-02-19 23:59:02+00:00,The Warriors Odds Of Going 73-9,['Kyle Wagner'],"As things stand coming out of the All-Star break, the Warriors will probably catch Michael Jordans 1995-96 Bulls, which own the record of 72 wins, and are a little better than a coin flip to pass them.

Last time we checked in on Golden States run to 73 was back in December, when the model gave the Warriors a 54 percent chance of getting at least 72 wins and a 44.1 percent chance of at least 73. A little more than two months later, the Warriors are 48-4 and those chances are 69.8 percent to hit 72 and an even 54 percent to reach 73. From where we sit, at least, the Warriors now appear likely to break the 96 Bulls record.

WINS SIMS CHANCE OF EXACTLY THIS MANY WINS CHANCE OF AT LEAST THIS MANY WINS 59 1 <0.1% 100.0% 60 1 <0.1 >99.9 61 1 <0.1 >99.9 62 5 <0.1 >99.9 63 21 <0.1 >99.9 64 53 0.1 99.9 65 138 0.3 99.8 66 314 0.6 99.6 67 634 1.3 98.9 68 1368 2.7 97.7 69 2585 5.2 94.9 70 4008 8.0 89.8 71 5996 12.0 81.7 72 7857 15.7 69.8 73 8559 17.1 54.0 74 8031 16.1 36.9 75 5754 11.5 20.9 76 3207 6.4 9.3 77 1224 2.5 2.9 78 243 0.5 0.5 50,000 CARM-Elo simulations of the Warriors season with data through Feb. 18

Our colleagues at ESPN Stats & Info once again have a less optimistic outlook, today giving the Warriors a 37 percent chance of hitting 73 or more wins. The explanation for the difference in the two models is the same as it was in December, when we were also more bullish than our colleagues: We devised a different rating system, called CARM-Elo, which allows good (or bad) runs of play in the simulations to inform a teams simulated strength through the rest of the simulated season. Basically, this means that it allows for extreme performance to be reflected in the results, and the Warriors are certainly extreme.

Still, all of the back-and-forth over exactly how good the Warriors are is more than a little backward. Any serious debate over whether Golden State is an all-time team dried up months ago; all thats left now is the dreary accounting of decimal points next to the teams name. Screw that. NBA nerds slapfighting over some grandiose meaning of the Warriors is boring  its the spectacle that matters, the crossovers and no-looks and nonsense transition threes, and how those feats of skill translate to the stat sheet. That in mind, heres a bunch of Warriors facts aimed at appreciating the wild mess theyre accomplishing this season, rather than simply measuring it.

The Warriors would have to miss their next 545 3-pointers to bring their team mark of 42.4 percent down to the level of the league-worst Lakers, at 31.5 percent.

If the Warriors completely gave up the 3-pointer and shot none of them per game from this point forward, the Timberwolves, who take the fewest threes per game, would need 50 games to catch up in attempts and 83 games to catch up in makes, pulling even right around the 137th game of the season.

In order to match the best 3-point-percentage season of Reggie Millers career (42.9 percent), Steph Curry (45.4 percent from three on 10.8 per game) would have to miss 31 straight threes; to match Larry Birds best (42.7 percent) hed need to miss 34 straight; to match LeBrons mark this season (27.4 percent) he would have to miss 354 straight 3-point shots.

Currys 646 3-point attempts last season were more than those Miller and Bird seasons combined  and hes on pace to demolish that number this year.

This foolishness:

Remember that two-month stretch in the summer of 2009 when Steph Curry might have gone to the Knicks, before Donnie Walsh and Mike DAntoni went around telling anyone who would stand still long enough to hear it exactly why Curry would be a superstar? And remember how disappointing it was, then, when Curry landed on a Warriors team that didnt use him at all in the way fans dreamed he might be used by the Pringles stache? Well, Curry found his way into the seven-seconds-or-less offense anyway. By NBA.coms count (which can lag a game or two behind), the Warriors have taken 299 threes in the first seven seconds of the shot clock and made 48.5 percent of them. The next closest by percentage is Indiana, at 42.5 on 167 attempts; Houston, first in attempts with 301 (in four more games than Golden State) has made 38.9 percent of its own; and the Thunder have found a way to make just 31.6 percent on 171 attempts. On all field goals in the seven-seconds-or-less window, the Warriors have a 68 percent effective field-goal percentage  the next closest is the Cavs, at 63.4 percent. The Knicks, meanwhile, are last in the league at 51.4 percent.

The Warriors are shooting 46.3 percent from three on wide open (defender more than 6 feet away) threes, best in the league. They also lead the league in open threes at 41 percent and tight coverage threes at 37.3 percent. They do fall to fourth in very tight threes (36.1 percent) but have taken only 36 of those all season.

Steph Curry is 11 for 24 on threes from 30 feet or more, according to nbawowy.com. Six of those shots (and one of the makes) were from beyond half court, meaning hes 10 for 18 between 30 feet and the center line. (The rest of the Warriors are 1 for 14 from 30-plus.) Consider this a reminder that Ben Morris dug into Stephs imperious shot selection in December.

(While were digging out old charts, get a load of Draymond in these.)

Oh, heres a scatter plot of 3-point attempts vs. 3-point percentage since the 1979-80 season, the first year of the 3-pointer:

The Warriors create 70.4 points per game through assists. The rest of the league has a fairly linear progression from the bottom on up  the Lakers are the worst, at 43.2, and the figure creeps up team by team until it stops with the Hawks, in second place, at 60.3. That isnt adjusted for tempo (the Warriors play at the second-fastest pace in the league), but the Dubs are also comfortably in first in percentage of passes that are assists, are secondary assists or lead to free throws.

According to nbaminer.com, Curry has scored 10 straight points for his team 10 times, the most in the league (James Harden is second with nine); hes scored 15 straight team points three times (Harden is second again, two) and 20 straight once (only Paul George has also done that this season). Curry has scored five straight unanswered points 55 times (Harden is second with 47, followed by George and Klay Thompson at 30).

points 55 times (Harden is second with 47, followed by George and Klay Thompson at 30). Probably the most alarming thing about the Warriors this season is how thoroughly they are outpacing the Spurs, another omega-level team stalking around the league. Also according to nbaminer.com, the Warriors average first-quarter margin is +6.04. The Spurs are second at +2.98. The Spurs remain ahead of the Warriors on the overall marks, +12.7 to +12.5, but this difference is more than accounted for in the fourth quarter, where the Warriors are -0.12 and the Spurs are an NBA-best +2.56. The Warriors average margin per overtime period is +4.0, best in the league.

And heres the same display of possible records we generated for the Warriors above, but for the Spurs.",[]
fivethirtyeight,2016-02-19 13:16:36+00:00,"Significant Digits For Friday, Feb. 19, 2016",['Walt Hickey'],"Youre reading Significant Digits, a daily digest of the telling numbers tucked inside the news.

3 votes

Three members of Californias Occupational Safety and Health standards board voted in favor of restrictions that would require pornographic performers in the state to work exclusively with condoms, one shy of the four required to institute the policy. Industry representatives argued the policy would ultimately make the business less safe by driving production underground. [ABC News]

6 teams

Projected number of NFL teams that will have more than $50 million in salary cap space come March 9. The league as a whole will have an unheard of $1 billion in total cap space based on the estimated $154 million salary cap for each team. [ESPN]

8 percent

Wal-Marts profits fell 8 percent last quarter despite modest sales growth, mostly due to costs associated with the planned closure of stores and a strong dollar, the company said. Wal-Mart has been attempting to pivot to digital sales but has seen growth of that business slow. [The New York Times]

30 percent

Percentage of never-married adults who have used an online dating site, one-and-a-half times the rate of those who have been separated or widowed and nearly four times the rate of those currently married or living with a partner. [Pew Research Center]

+53 favorability rating

In sentences I didnt anticipate ever writing: Pope Francis and Donald Trump have butted heads. The spat started after remarks from the pope seemed to imply that supporting a wall at the border  as Trump does  makes one a poor Christian. So of course Trump is now fighting the pope. Cool! Good luck to Trump: Americans view the pope rather favorably  a 53 percent net positive favorability rating  and Trump rather negatively  a 27 percent net negative approval rating. Honestly, the last square on my election bingo card is Candidate is called a papist by rival, so Im guessing its only a matter of time. [FiveThirtyEight]

80 percent

When Rio de Janeiro applied to host the Olympics, the city promised to improve water quality by 80 percent in the areas where rowers, sailors and triathletes would compete. The city has totally failed to meet that figure: Theres actual poop in the water, and now teams are taking precautions to make sure their athletes stay healthy after rowing in the effluence. [ESPN]

$231

Annual cost of renting a cable box to an average household, according to FCC chairman Tom Wheeler. The FCC voted Thursday to require cable companies to give out information to third-party manufacturers, meaning those manufacturers will eventually be able to sell competitor devices to consumers who no longer want to rent one from their cable company. [Tech Insider]

450,000 calls

Number of calls to a suicide hotline operated by the Department of Veterans Affairs in 2014. During times of high volume, about a sixth of those calls are routed to backup call centers. However, a report from the VA inspector general found that some of those calls went to voicemail at the backup centers. [CBS News]

$30 million

The Michigan House approved a measure that would allocate $30 million to pay the water bills of Flint residents. Flint had some of the costliest water in the country and it also happened to be filled with toxic lead. [The Washington Post]

$35.1 million

How much advertisers are expected to spend on podcasts in 2016, according to ZenithOptimedia, a group that analyzes the marketing business. Thats higher than last year but still small compared to the $18 billion dropped on radio every year. Step it up, John D. and Catherine T. MacArthur Foundation and MailChimp. [The Wall Street Journal]

If you havent already, you really need to sign up for the Significant Digits newsletter  be the first to learn about the numbers behind the news.

If you see a significant digit in the wild, send it to me: @WaltHickey.",[]
fivethirtyeight,2016-02-20 18:30:26+00:00,South Carolina Republican Primary: Live Coverage,[],"Never miss the best of FiveThirtyEight.

The best of FiveThirtyEight, delivered to you.

Thanks for submitting!

You should receive a confirmation in your inbox shortly.

Politics Dispatch

Our take on all things 2016. Significant Digits (Daily)

Our roundup of numbers in the news. What You Missed at FiveThirtyEight (Weekly)

Highlights from the past week.",[]
