Source,Date,Title,Authors,Text,Keywords
fivethirtyeight,2014-11-21 17:46:32+00:00,Skeptical Football: Patriots vs. Cardinals And An Interactive History Of The NFL,['Benjamin Morris'],"The first 10 games of the NFL season are its exposition period  we get to know the characters and themes that we expect to see develop as the race to the playoffs unfolds. This year, like nearly every other in the past decade, the New England Patriots refusal to regress to the mean is a central storyline.

Remember back when the Patriots were 0-1 and faced a must-win in Week 2? Well, they won. Then in Week 4 they dropped to 2-2, and the end of an era was supposedly nigh. Except no. Pats will be Pats, and now theyve won their last six games en route to the best record in the AFC. That streak has included comfortable wins against the Cincinnati Bengals (who at one point projected to have the best record), the surprisingly strong Buffalo Bills, and Peyton Manning and Andrew Luck. (The Patriots are also tied with the Green Bay Packers for a league-leading point differential). And according to my colleague Neil Paine, the Patriots are really a second-half team. I shudder to think.

But theres another storyline thats dominated the exposition period: The best record in the NFL belongs to the 9-1 Arizona Cardinals. While theyve beaten some decent teams like Dallas, Philadelphia and San Francisco, they dont have what the yakkers call a signature win. They have only the seventh-best SRS in football, second to the Packers in the NFC, and only a half-point ahead of the defending champion Seattle Seahawks (who have four losses).

Aside from being the class of their respective conferences so far this year, the two franchises have little in common. The Cardinals have now secured their second winning season in a row  and can count that as an accomplishment in light of their 90-year history of losing. Although the Patriots dominance of the regular season continues apace, they will likely be disappointed if they dont win their first Super Bowl in 10 years.

To illustrate just how divergent these two franchises have been, I created a chart to show the entire history of the NFL (or at least what we have stats for). This is the cumulative regular-season point differential since 1920, for all teams (with the Patriots and the Cardinals highlighted):

The current Patriots dynasty is lengthy and steep, and belongs in the same group as the San Francisco 49ers of the 1980s, the Cleveland Browns of the 50s and 60s, or the Chicago Bears of the 30s and 40s (especially when you factor in league parity).

That chart is fun, but it would be a lot more useful if we could make out all 81 NFL franchises individually. Well ...

Chart of the week

Thanks to the great work of designated Skeptical Football charts guru Reuben Fischer-Baum, you can do just that. Roll over a line to see the teams entire history, and move along the line to see exactly how many points it has scored compared to its opponents at a given point. You can also click on a team to keep its line highlighted, and then roll over another team for comparison. Irrelevant dates (where no regular-season games were played) are excluded from the timeline.

Here are a couple of things I found from the interactive that I thought were interesting:

Even more Aaron Rodgers

First, Aaron Rodgers  apparently unmoved by my ongoing criticism of his failure to throw more interceptions  is absolutely tearing it up this year (at least when his team is ahead, which is most of the time lately). Recently, he accomplished something pretty cool that I didnt know about:

On Sept. 25, 2011, Rodgers threw three touchdown passes as the Green Bay Packers beat the Chicago Bears 27-17. With that result, the Packers had scored 2,991 more points than their opponents all-time, ahead of the Bears 2,989  and the Packers havent looked back. As of last Sunday, Green Bay held the NFLs best historical margin of victory by 358 points.

Comment of the week

Last week Neil Paine and I wrote an article titled Randy Moss May Well Have Been The Greatest Receiver Of All Time  which focused on the insane With Or Without You stats that Moss put up in his career. In the discussion, we raised the possibility that if receivers can have as much of an impact as Randy Moss appeared to have, that may cast doubt on some previous knowledge  like how good of a quarterback Joe Montana was considering he had Jerry Rice running routes for so long.

A few different people in the comments and elsewhere raised the point that Joe Montana had already won two Super Bowls before Jerry Rice arrived in San Francisco:

Upon further consideration, Im inclined to agree that its fairly unlikely that Rice was the driving force behind the 49ers success. But Im not so sure Montana was either.

Winning in the NFL can happen for a lot of different reasons  a star quarterback (think Peyton Manning), a successful new offensive or defensive strategy (think West Coast offense, zone blitz, or, more recently, the Wildcat), or a standout player who creates mismatches that other teams struggle with (think Randy Moss). But the effects of various win-generating phenomena can come in a lot of shapes and sizes.

For example, lets compare the 49ers to the St. Louis Rams. Pay particular attention to the Greatest Show on Turf era from 1999 into the early 2000s:

The Greatest Show on Turf Rams had a few different things going for them, but their success was sudden, rocky, and lasted only a few years. They broke the game for a while in the sense that they were something the rest of the NFL didnt know how to deal with. But despite having a lasting effect on how football is played, their dominance was fragile.

On the other hand, from the early 80s to the late 90s, the 49ers outscored their opponents by around 2,500 points  by far the most dominant stretch in the Super Bowl era. And they did it with a practically straight line, meaning they were better than their opposition by a nearly constant amount.

If the 49ers owed a significant part of their success to any one player (or phenomenon of any kind), wed likely see more variety in the teams arc as that players performance fluctuated, or as he was injured, or left. But the consistency of the 49ers ascension suggests they were more of an organization-driven phenomenon. At the very least, it implies that they were the sum of many different quality parts.

Playing around with the interactive, Im fascinated by how different phenomena manifest. For example: How do the impacts of offensive and defensive innovation compare? What are the effects of a quarterback versus those of a coach? There are a lot of possibilities, so let us know what you uncover in the comments or on Twitter.

Week 11 kicking awards

I keep thinking (and my editor keeps hoping) this will be the week I wont bother talking about kickers, but then Las Vegas Locomotives alumnus Graham Gano has to go and attempt a 63-yard field goal with one second left in a thriller between the Carolina Panthers and the Atlanta Falcons. Unfortunately for the Panthers, it was blocked.

My kicking model suggests that a kicker in 2014 should typically be able to make a 63-yard field goal around 40 percent of the time  but this may be skewed by the fact that such long kicks are so rarely attempted. Still, Ganos 63-yarder wasnt what earned him the kicker loss and Week 11s Least Valuable Kicker award. What did him in was his previous miss, a 46-yarder, which a 2014 NFL kicker should typically make about 77 percent of the time.

My algorithm picked the Falcons Matt Bryant as the MVK over the St. Louis Rams Greg Zeurlein (who had an excellent week, going 5/5 with two 50+ yarders in the Rams huge upset of the Broncos), on account of Bryant making four field goals in a game his team only won by two (though none was over 44 yards).

But the biggest news of the week is that with Nick Novak missing a kick for the San Diego Chargers, were down to just two perfect kickers, and theyre both veterans: the Indianapolis Colts Adam Vinatieri and the New York Giants Josh Brown.

Gunslinger of the week

There were 26 interceptions thrown in Week 11, and seven of them were thrown by the Manning brothers. Eli Manning had five in the Giants narrow loss against the 49ers  four of which were thrown with his team trailing  enough to win him our Gunslinger of the Week award.

Throwing a practically embarrassing number of interceptions now and then is something great quarterbacks do. QBs, dont be ashamed of looking bad when trying to win! A loss is a loss, whether you throw zero interceptions or six. My maxim is: If a quarterback loses a game without throwing a few interceptions, he probably didnt try hard enough.

In general, Eli Manning is a bit of an unknown. He puts up fairly big totals for a mediocre team, but often gets criticized for his high interception rate. Yet his win curve looks mostly like his big brothers, only flatter, and its plausible that his shame-free style was partially responsible for the Giants shocking wins in two Super Bowls. Elis gambling wouldnt necessarily make the Giants favorites against stronger competition, but it might have given them a better chance against a team like the 2007 Patriots than a better team with a quarterback who took fewer risks.

Just for fun, I looked at the Pro Football Reference list of quarterbacks with the most four-plus-interception games. The top four are George Blanda, Joe Namath, Ken Stabler and Terry Bradshaw (all of whom won championships, and three of whom are in the Hall of Fame). Of the top 50 such QBs, 15 have won championships (and account for 20 Super Bowls), including both brothers Manning.

Rookie QB watch

The biggest news in rookie QB-land was in Tennessee, where sixth-round-pick Zach Mettenberger had a fairly strong game against the Pittsburgh Steelers (263 yards and two touchdowns). Hes now guaranteed to reach the magical four-start line when rookie QBs are more likely to have successful careers. Im not quite ready to move him up in the rankings just yet, but every pass he completes is one more than Johnny Manziel has completed all year. As of now, Id order the rookies estimated career prospects like so:

The Jacksonville Jaguars Blake Bortles had a bye week. The Oakland Raiders Derek Carr, despite finally winning a game Thursday night (in dramatic fashion) has had a pretty weak couple of weeks, with just 172 and 174 yards in Weeks 11 and 12, despite a combined 69 pass attempts. The Minnesota Vikings Teddy Bridgewaters two game winning streak came to an end in Chicago. Mettenberger. The Patriots Jimmy Garropolo. Manziel once again got all dressed up with no ball to throw.

Not really in the game yet but worth keeping an eye on: Logan Thomas is now second on the depth chart in Arizona. So far this year he has a 108.9 NFL Passer Rating, but hes gotten it the hard way: He has only one completion in eight attempts (10 if you count sacks), but it went for 81 yards and a touchdown.

Reader response

In Week 9s column, I introduced my experimental win curves for quarterbacks, which depict how much each QB typically wins relative to various expectations, and I included a number of examples.

I covered most popular quarterbacks, with a couple of notable exceptions. One request I got an awful lot:

@skepticalsports As a Bears fan, I'd love to see the ""Win Curve"" for Jay Cutler that you wrote about in your latest @FiveThirtyEight column  John D. Kos (@johndkos) November 7, 2014

I would have included Cutler initially, but I had a problem with his curve: It was coming out as a perfectly straight line, virtually indistinguishable from the y=x guide (a highly unlikely outcome). I thought this might have been a data problem, but it turns out Cutlers results really were just too vanilla for the method I was using to pick up the variation. So I tried an alternate method that is more sensitive to small variation. The alternate method turned out to be less sensitive to large variation as well, so I was able to plot a couple more notable quarterbacks as well as Cutler:

Russell Wilson  like his comrade Andrew Luck  has a very impressive curve so far in his career, albeit over a sample still probably too small for this analysis. (He also gets very good support from a strong team around him.)

Cutlers curve is still remarkably unremarkable, but at least it shows up. He appears to do slightly above average regardless of the circumstances. As a special treat for Bears fans who had to wait two weeks  and because I wanted to see what was going into this virtually straight line  Ive broken down Cutlers curve by quarter, and compared each to the same breakdown for Peyton Manning (our standard-bearer for such things):

Being very far ahead or behind in the first quarter is rare, so you should take the tails of that quadrant with a grain of salt. In the second and fourth quarters, Cutler seems to outperform average in a pretty uniform way, and in the third-quarter he has a bit of a reverse-Matthew Stafford thing going on.

Most empirically significant game of this week

The Cardinals matchup against the defending champion Seahawks is a pretty big test for the team with the leagues best record.

But on top of that, the Cardinals have a lot of important parts coming and going, which is always empirically significant: Their top QB (Carson Palmer) is out. Last week, Cardinals backup Drew Stanton held off the Detroit Lions Stafford at the end of the game, but the Cardinals still struggled. Leading for most of the game, they rushed 26 times, but gained only 46 yards. And their top receiver, Larry Fitzgerald, is injured but may play anyway. As demonstrated in the article on Moss, the value of top-notch WRs can affect our broader understanding of the game.

And then there are the Seahawks  who were young powerhouses last year, but are possibly already in decline  and Russell Wilson, who last year averaged 33.7 yards rushing per game. Thats by far the most of any QB in a year his team won the Super Bowl  and hes averaging 57.1 per game this year. What running quarterbacks mean for the game is a fascinating open question. A lot of newer, fancier QB-rating systems are giving QBs a lot of credit for their scrambling (often much more than if you treated those plays the same as completed pass attempts). But while those individual plays can be valuable, there havent been a lot of dynamic offenses built around running QBs, and its still unclear whether this is just a bonus skill or whether it will be a necessity in the future NFL.

Its perhaps even more valuable to see Wilson in action with the Seahawks struggling a bit (it can also be harder to isolate an individual players contributions when a team is firing on all cylinders). Hell be tested against a Cardinals defense that grades out as one of the best in the NFL this year  a perfect opportunity to see what both are made of.

Reminder: If you tweet questions to me @skepticalsports, there is a non-zero chance that Ill answer them here.

Charts by Reuben Fischer-Baum.","['week', 'skeptical', 'football', 'won', 'win', 'nfl', 'cardinals', 'game', 'vs', 'patriots', 'lot', 'team', 'line', 'interactive', 'history']"
fivethirtyeight,2016-02-21 05:16:59+00:00,Trump Optimists And Trump Skeptics Are About To Go To War,['Nate Silver'],"If you think the arguments between the Republican candidates have been bad, well, you aint seen nothing yet. Pundits, reporters and political analysts are going to really have at it. Two competing theories about the Republican race are about to come to a head, and both of them can claim a victory of sorts after South Carolina.

The first theory is simple. It can be summarized in one word: Trump! The more detailed version would argue the following:

Trump has easily won two of the first three states.

Trump is ahead in the polls in pretty much every remaining state.

Trump is ahead in delegates  in fact, he may win all 50 delegates from South Carolina.

Trump has been extremely resilient despite pundits constantly predicting his demise. Hes been at 35 percent in national polls for months now. Thats as steady as it gets!

So, um, isnt it obvious that Trump is going to be the Republican nominee?

Not so, say the Trump skeptics. Their case is pretty simple also:

Trump is winning states, but hes only getting about one-third of the vote.

Trump has a relatively low ceiling on his support.

Trump now has a chief rival: Florida senator Marco Rubio.

What did the Trump skeptics find to like about South Carolina? Quite a lot, actually. Theyd point out that Trump faded down the stretch run, getting 32 percent of the vote after initially polling at about 36 percent after New Hampshire, because of his continuing struggles with late-deciding voters. Theyd note that Trumps numbers worsened from New Hampshire to South Carolina despite several candidates having dropped out. Theyd say that Rubio, who went from 11 percent in South Carolina polls before Iowa to 22 percent of the vote on Saturday night, had a pretty good night. Theyd also say that Rubio will be helped by Jeb Bush dropping out, even if it had already become clear that Rubio was the preferred choice of Republican Party elites.

So what? sayeth the Trump optimists. Second place means youre a loser! Theres no guarantee that the other candidates will drop out any time soon. And as Trump himself has argued, its a mistake to assume that all of the support from Bush and other candidates will wind up in Rubios column. Some of it will go to Trump!

Indeed, other candidates remaining in the race are a big problem for Trump skeptics. Bush is gone, but John Kasich is still in, and he may hinder Rubio in states like Ohio. More importantly, Ted Cruz is still winning something like 20 percent of the Republican vote. Although Cruzs delegate math doesnt look good  his strongest states are those that allocate their delegates proportionally, whereas Rubio and Trump are variously strong in winner-take-all states  hell stay in the race through Super Tuesday and possibly for a lot longer.

Trump optimists other point is more of a straw man argument, however. The Trump skeptics arent presuming that Rubio will magically pick up all the support from Bush (and eventually, from Kasich and Cruz). Theyre looking at polls that have consistently shown Rubio picking up more second-choice support than Trump does. In some polls, thats enough for Rubio to tie or overtake Trump. In others it isnt. But virtually all polls have the race getting closer as the field winnows. Likewise, almost all polls (both state polls and national polls) show Rubio with higher favorability ratings than Trump.

I should note that the Trump skeptics find the Trump optimists a bit exasperating on this point. (Why are you talking about yourself in the third person, Nate?) The idea that Trump has a ceiling  or to be more precise, will encounter a lot of upward resistance as he seeks to gain more support  is not some type of special pleading. Instead, its a point the Trump skeptics have raised from the very earliest stages of Trumps campaign. And theyve seen some evidence to validate it from Iowa, New Hampshire and South Carolina, along with recent polling.

A reasonable person might adjudicate the case as follows: Yes, if the Republican nomination becomes a two-man race between Trump and Rubio, it could be pretty close. But that might not happen, or it at least might not happen for a while, not until Trump is off to a pretty big head start in delegates. What happens in a three-way race between Trump, Rubio and Cruz is a little murky. This reasonable person would concede that Rubio had a chance. But whos the favorite? Trump!

The Trump skeptics might bring up one last line of argument. Theyd claim, perhaps more tentatively than they did before, that GOP elites still have some ability to influence the race. Maybe voters dont care about what the establishment thinks, but individual Republican politicians can still have some influence  South Carolina Gov. Nikki Haleys endorsement of Rubio very probably helped him, for instance. These elites have quite a bit of money to throw around, especially with Bush out. They have some more subtle advantages: They can pack a debate hall with Rubio supporters, for instance. Or they could try to rule by brute force: If the Republican race goes to a contested convention, which is not at all unimaginable, were suddenly back in the pre-1972, smoke-filled-rooms era, although probably with delegates vaping instead of puffing on cigars.

Betting markets, weighing all of this information, see the Republican race thusly: Trump at about 50 percent to win the nomination, Rubio at 40 percent, and the rest of the field at 10 percent. I might quibble here and there, but that seems like basically a sound assessment. Now, lets get back to arguing on Twitter.

Listen to the latest episode of the FiveThirtyEight Elections podcast.

Subscribe: iTunes | Download | RSS | Video","['republican', 'trump', 'optimists', 'polls', 'delegates', 'rubio', 'race', 'skeptics', 'theyd', 'pretty', 'war', 'south']"
