fivethirtyeight.com,2016-03-09 12:32:04+00:00,We Now Have Algorithms To Predict Police Misconduct,['Rob Arthur'],"On a sweltering Monday in late June 2015, the city council in Charlotte, North Carolina, met to discuss, among other items in a seven-hour marathon, how to carry out a controversial new approach to predicting police misconduct. Opinions were divided, and the discussion was tense. One council member was afraid of upsetting the troops. A second called the use of data about individual police officers an invasion of privacy. In response, another said, Im always a fan of third parties looking over our shoulder.

Finally, Kerr Putney, soon to be sworn in as Charlottes new police chief, got up to reassure the council. He spoke about the need to balance public need versus what officers may want. He seemed to persuade several members.

So it wont be used for retribution? one asked. Absolutely not, Putney replied.

Minutes later, the council voted to work with a group of data scientists to develop a sophisticated system for predicting when cops will go bad. These researchers, part of the White Houses Police Data Initiative, say their algorithm can foresee adverse interactions between officers and civilians, ranging from impolite traffic stops to fatal shootings. Their system can suggest preventive measures  an appealing prospect for police departments facing greater scrutiny and calls for accountability. Two other large departments  the Los Angeles County sheriff and the Knoxville police  have signed on to use the research to develop new systems, and several other agencies have expressed interest. The scientists hope their method can serve as a template for stopping police misbehavior before it happens.

Many police departments have early warning systems  software that tracks each officers performance and aims to forecast potential problems. The systems identify officers with troubling patterns of behavior, allowing superiors to monitor these cops more closely or intervene and send them to counseling.

The researchers, a mixed group of graduate and undergraduate students working together at the University of Chicago with backgrounds in statistics, programming, economics and related disciplines, are trying to build a better kind of early warning system. They began their task last summer with a request from the Charlotte-Mecklenburg Police Department: Predict when police officers would participate in adverse interactions with civilians.

To build their early warning system, the University of Chicago group first looked for signals in the data that an officer might be going astray. They used a comprehensive data set of interactions between cops and the public gathered by Charlotte police officials over more than a decade. The researchers found that the most potent predictor of adverse interactions in a given year was an officers own history. Cops with many instances of adverse interactions in one year were the most likely to have them in the next year. Using this and other indicators, the University of Chicago groups algorithm was better able than Charlottes existing system to predict trouble.

The algorithm holds great promise for its cleverness and its accuracy. But the idea of using statistical models to predict police misconduct is not new, and past efforts have often met with resistance. In fact, the Chicago Police Department  now under intense federal scrutiny in the wake of the Laquan McDonald shooting  constructed such an algorithm more than 20 years ago, only to abandon it under pressure from the officers union, the Fraternal Order of Police.

Ironically, the Chicago Police Department crafted the approach partly because of criticism from the union. A previous early warning system, based on the recommendations of departmental supervisors, was itself the subject of a union grievance calling it subjective and inconsistent. Seeking a more objective way to identify troubled officers, the Internal Affairs office bought state-of-the-art software from a company called California Scientific. The software was to use neural-network-based data analysis to build models for predicting which officers would be fired for misconduct.

The departments forward-thinking approach immediately attracted press attention. Articles in outlets as diverse as Scientific American and Playboy praised the sophistication of the method while raising questions about its moral dimensions: Could any computer algorithm, they asked, take into account the particular circumstances of officers behavior and foresee whether they would commit misconduct?

The list of predictive factors Internal Affairs found using the software is consistent with other studies of police misconduct, including my own. Along with each officers past history of complaints, Internal Affairs identified personal stressors linked to bad behavior. If an officer had recently divorced or gone into serious debt, for example, he was flagged by the algorithm as more likely to commit misconduct in the future. Like employees of any other kind, cops are likely to see their job performance suffer when there is trouble in their personal lives.

The neural network didnt last long: about two years from the first announcement to its formal shutdown. (And all its reports and predictions went missing at some point in that period.) Soon after the model produced its first predictions, the union intervened; its president, Bill Nolan, called the system absolutely ludicrous. In particular, he objected to the way administrators responded to the predictions: Internal Affairs handed over a list of about 200 officers to Human Resources, which called each one into the office for questioning the union called adversarial.

Human Resources then recommended some officers for a counseling program (about half of the flagged officers were already enrolled in counseling because of previous bad behavior). Nolan said police officers were being punished for crimes they had not yet committed.

At the time, the notion of using predictive analytics to forecast potentially criminal behavior was still quite foreign. Although 27 percent of departments reported using some kind of early warning system in 1999 (according to a Department of Justice study), most existing models were simple, based either on supervisor observations or on an officers exceeding a certain number of complaints in a given period. (Both Chicagos current system and Charlottes previous algorithm use such thresholds.) The idea of a more sophisticated algorithm seemed spooky back then, and union leaders called the Chicago PDs model a crystal-ball thing. Mark Lawrence, the CEO of California Scientific, received a handful of inquiries from other police departments, but he said interest in his software dropped off rapidly after the unions well-publicized objections. (The Fraternal Order of Police did not respond to multiple requests for comment for this story.)

Now, advanced statistical models designed to quantify, measure and predict crime have become common tools in police departments across the country. But the Chicago experience illustrates the difficulty in getting smart early warning systems to stick. By developing their algorithm in partnership with officers, the University of Chicago team hopes to gain acceptance from the Charlotte police force as a whole and not just its administrators.

Instead of identifying and intimidating officers at risk of being fired, the new algorithm seeks to head off troublesome behavior. The team worked in close collaboration with the Charlotte police force, which volunteered for the program to upgrade its early warning system and prevent misconduct, despite having a relatively low rate of officer-involved violence. Over the course of several ridealongs, focus groups and field interviews with officers, the data scientists developed a feel for some of the challenges of modern policing. Officers deal with a lot of things the typical person on the street doesnt really think about, said Joe Walsh, a data scientist and mentor assigned to supervise the project.

In addition to the prognostic value of past complaints, the University of Chicago group uncovered some less obvious factors that may predict police misconduct. Incidents that officers deemed stressful were a major contributor; cops who had taken part in suicide and domestic-violence calls earlier in their shifts were much more likely to be involved in adverse interactions later in the day. Its notable that although stressful calls emerged as a powerful predictor, right now there is no way to control which officers are dispatched to crimes based on the number or kind of previous calls during their shifts.

Charlottes previous early intervention system was based on a simple threshold formula: Cops who had more than three adverse interactions in the past 180 days were flagged as a risk for problems in the next year. Supervisors then decided what corrective action to take, from changing the officers duties to recommending them for counseling.

To compare the systems effectiveness with that of their new algorithm, the Chicago researchers broke their data into yearlong chunks. After training the algorithm to look for variables that predicted adverse interactions in past years, they tested the algorithm on more recent data to see whether it could make accurate predictions for individual officers, taking into account whether they had been disciplined or sent to counseling during the year.

The researchers say the prior system overestimated the number of officers at risk: 50 percent of the flagged officers in the data set did not go on to participate in an adverse interaction in the next year. And this was not because of successful interventions by the police department, since officers flagged by the system were often not directed to counseling.

The new algorithm flags 15 percent fewer officers than the old one, creating a smaller list for the department to monitor. (The researchers did not provide me with absolute numbers.) Yet it correctly identified more of the officers who went on to participate in adverse interactions in the following year, suggesting that the new system is more sensitive.

Because the algorithm is still in a pilot phase and not in active use, the researchers dont know whether their predictions will translate into interventions that reduce the probability of adverse interactions. But three separate studies of police agencies that implemented early warning systems (in Miami, Minneapolis and New Orleans) have shown that targeted intervention can reduce citizen complaints against officers as much as 66 percent over two to three years. The more accurate the predictions, the more powerful those interventions become, and the more adverse interactions can be prevented.",[]
fivethirtyeight.com,2016-03-07 17:21:33+00:00,Donald Trump Would Be Easy To Stop Under Democratic Rules,['Nate Silver'],"The other Republican candidates chances of stopping Donald Trump look marginally better today than they did on Friday. Trump won just two of five contests over the weekend and only 30 percent of delegates. Trump remains the front-runner, however, having won 43 percent of the delegates overall among the 20 states and territories to have voted so far.

Although thats short of a majority, Trump will have a chance to improve on his pace as the calendar turns toward states that have more aggressive delegate allocation methods  especially winner-take-all Florida and Ohio, which vote March 15. If Trump wins both states, hell have a good chance of eventually getting a delegate majority. If he loses both, we might be headed to a contested convention in Cleveland. And if Trump splits them  perhaps the most likely outcome based on where polls stand  well continue to be on knifes edge.

The reason these details matter so much is because of how the GOPs delegate rules are structured. If the Republican nomination were contested under Democratic delegate rules instead, Trump would find it almost impossible to get a majority of delegates, and a floor fight in Cleveland would already be all but inevitable. If every state awarded its delegates winner-take-all, conversely, Trump would be much further ahead, although the bigger swings these rules enable would give his opponents a chance to catch up later on. In the rest of this article, Ill run the numbers on how many delegates Trump, Ted Cruz and Marco Rubio would have won so far under three alternate sets of rules, including the two I just mentioned.

First, Ill apply winner-take-all rules in every state.

Second, Ill apply Democratic delegate rules. Unlike Republicans, Democrats have essentially the same rules from state to state. Specifically, their delegates are allocated proportionally, subject to a 15 percent qualifying threshold. Also, about 15 percent of Democratic delegates are superdelegates who will go to the convention unbound to any candidate. One complication Ill ignore: States award some of their Democratic delegates by congressional district  some states Republican rules do this also  but this makes relatively little difference under proportional allocation, so my calculations are based on the statewide vote instead.

Third, Ill apply what I call uniform Republican rules. This one requires a bit more explanation. Republican delegate rules vary quite a bit from state to state, ranging from being extremely proportional (as in, say, North Carolina) to strictly winner-take-all (in Arizona, for instance). Under my uniform rules, the allocation is the same in each state instead and is intended to reflect a compromise between proportional and winner-take-all methods. Specifically:

One-third of delegates in each state are awarded to the winning candidate. If the winning candidate gets more than 50 percent of the states vote, the bonus increases to half a states delegates.

Five percent of delegates in each state are unbound, essentially making them superdelegates.

The remaining delegates in each state are allocated proportionally, subject to a 15 percent minimum threshold.

These rules might seem arbitrary, but theyre meant to reflect a rough average or consensus of the methods Republicans are applying now. For instance, about 23 percent of Republican delegates are awarded winner-take-all by state and another 14 percent are winner-take-all by congressional district. Thats 37 percent total, close to my one-third winner-take-all bonus.

Meanwhile, states where Republican delegates are awarded proportionally usually have a qualifying threshold, as Democrats do. The average threshold is about 15 percent, so thats what my uniform rules apply. Furthermore, some of the proportional states become winner-take-all if a candidate receives more than 50 percent of the vote, although others dont. Hence, my compromise rules award half of the delegates to any candidate winning with a majority of votes, plus whatever additional delegates he picks up from his proportional allocation.

Finally, although Republicans dont have superdelegates in the same way that Democrats do, they will have some delegates go to the convention unbound. Specifically, the delegations from North Dakota, Wyoming and several territories wont be bound to any candidate; also, some delegates selected in Pennsylvanias loophole primary are technically unbound. These cases represent about 5 percent of Republican delegates or perhaps a bit more, depending on how you evaluate some ambiguous rules in West Virginia and other states.

Heres how many delegates Trump would have under each allocation method:

TRUMPS DELEGATE COUNT UNDER ... DATE STATE OR TERRITORY CURRENT RULES WINNER-TAKE-ALL RULES DEM. RULES UNIFORM GOP RULES Feb. 1 Iowa 7 0 8 6 Feb. 9 New Hampshire 11 23 14 18 Feb. 20 South Carolina 50 50 18 30 Feb. 23 Nevada 14 30 13 19 March 1 Alabama 36 50 22 33 Alaska 11 0 9 7 Arkansas 16 40 13 22 Georgia 43 76 29 46 Massachusetts 22 42 21 29 Minnesota 8 0 8 6 Oklahoma 14 0 12 9 Tennessee 33 58 22 36 Texas 48 0 40 29 Vermont 8 16 6 9 Virginia 17 49 17 29 March 5 Kansas 9 0 9 7 Kentucky 17 46 17 27 Louisiana 18 46 20 30 Maine 9 0 8 6 March 6 Puerto Rico 0 0 0 0 Total 391 526 306 398 Share of all delegates 43% 58% 34% 44% How Trumps delegate total would change under different rules Source: The GREEN PAPERS

Trump had 391 delegates as of Sunday evening, according to The Green Papers. Under my proposed uniform Republican rules, hed have pretty much the same number of delegates, 398. In other words, so far Trump has neither been helped nor hurt much by the variation in delegate rules from state to state. States where Trump has benefited from more aggressive methods, such as South Carolina, have been offset by others like proportional Massachusetts.

But switching to Democratic rules would make a big difference. Between the highly proportional allocation method and the large number of superdelegates, Trump would have received only 306 delegates so far, more than any other candidate but still just 34 percent of the total. It would be hard for Trump to ever get a majority under these circumstances; hed have to get at least 72 percent of the elected delegates from the remaining states, or hed need help from superdelegates who might not be willing to provide it to him.

Conversely, if all Republican delegates were awarded winner-take-all, Trump would already have 526 delegates, or 58 percent of the total so far. Hed be in good shape for the nomination, although hed still have to worry about another candidate like Cruz getting hot and winning most states in the second half of the calendar.

Speaking of which, here are the numbers for Cruz:

CRUZS DELEGATE COUNT UNDER ... DATE STATE OR TERRITORY CURRENT RULES WINNER-TAKE-ALL RULES DEM. RULES UNIFORM GOP RULES Feb. 1 Iowa 8 30 9 17 Feb. 9 New Hampshire 3 0 0 0 Feb. 20 South Carolina 0 0 12 9 Feb. 23 Nevada 6 0 6 4 March 1 Alabama 13 0 11 8 Alaska 12 28 10 17 Arkansas 15 0 12 9 Georgia 17 0 18 13 Massachusetts 4 0 0 0 Minnesota 13 0 11 8 Oklahoma 16 43 14 24 Tennessee 16 0 14 10 Texas 104 155 65 99 Vermont 0 0 0 0 Virginia 8 0 8 6 March 5 Kansas 24 40 19 27 Kentucky 15 0 15 11 Louisiana 18 0 19 14 Maine 12 23 12 16 March 6 Puerto Rico 0 0 0 0 Total 304 319 255 292 Share of all delegates 34% 35% 28% 32% How Cruzs delegate total would change under different rules Source: The GREEN PAPERS

Cruzs total is somewhat indifferent to these rules changes. Hed have slightly more delegates under a winner-take-all system than he does now, but hed also be much further behind Trump. As a corollary, although hed have fewer delegates under Democratic rules, hed be much closer to Trump.

Rubios delegate math is more sensitive to rules changes:

RUBIOS DELEGATE COUNT UNDER ... DATE STATE OR TERRITORY CURRENT RULES WINNER-TAKE-ALL RULES DEM. RULES UNIFORM GOP RULES Feb. 1 Iowa 7 0 8 6 Feb. 9 New Hampshire 2 0 0 0 Feb. 20 South Carolina 0 0 12 9 Feb. 23 Nevada 7 0 7 5 March 1 Alabama 1 0 9 7 Alaska 5 0 4 3 Arkansas 9 0 10 7 Georgia 16 0 18 13 Massachusetts 8 0 8 5 Minnesota 17 38 13 23 Oklahoma 13 0 11 8 Tennessee 9 0 12 9 Texas 3 0 27 19 Vermont 0 0 3 2 Virginia 16 0 16 12 March 5 Kansas 6 0 6 5 Kentucky 7 0 8 6 Louisiana 5 0 0 0 Maine 0 0 0 0 March 6 Puerto Rico 23 23 20 22 Total 154 61 192 161 Share of all delegates 17% 7% 21% 18% How Rubios delegate total would change under different rules Source: The GREEN PAPERS

Of course, winner-take-all would be awful for Rubio, who has won only Minnesota and Puerto Rico; together theyd give him just 7 percent of delegates. However, Democratic rules would be pretty good for him. Hed have 21 percent of delegates, not all that far behind Cruzs 28 percent and Trumps 34 percent, and with a chance to emerge as the nominee out of the highly probable contested convention.

Note how profoundly all of this would change the strategy for Republicans hoping to stop Trump. Under winner-take-all rules, it would be essential to winnow the field down to one main challenger, if it werent already too late. Under Democratic rules, the strategy would be for candidates to stay in the race instead, keeping Trump well short of a majority as everyone prepared for a contested convention. The Republicans actual rules are somewhere in between, making it hard to find the right approach.

Listen to the latest episode of the FiveThirtyEight elections podcast.

Subscribe: iTunes | Download | RSS | Video",[]
fivethirtyeight.com,2016-03-08 23:00:00+00:00,What Went Down In The March 8 Presidential Primaries,[],"Never miss the best of FiveThirtyEight.

The best of FiveThirtyEight, delivered to you.

Thanks for submitting!

You should receive a confirmation in your inbox shortly.

Politics Dispatch

Our take on all things 2016. Significant Digits (Daily)

Our roundup of numbers in the news. What You Missed at FiveThirtyEight (Weekly)

Highlights from the past week.",[]
fivethirtyeight.com,2016-03-07 23:10:23+00:00,Lakers Over Warriors Was Only The 23rd-Biggest Upset In NBA History,['Neil Paine'],"Any time the Golden State Warriors lose, its big news  thats what happens when a team is battling ghosts, trying to stay ahead of the Chicago Bulls record pace from two decades ago. But for the loss to come against the lowly Los Angeles Lakers? They of the 12-51 record, a full 4412 games worse than Golden States tally going into the matchup? It bordered on the unthinkable, particularly because basketball sees fewer upsets than other sports.

Yet this kind of loss does happen from time to time in the NBA, and to teams favored even more heavily than Golden State was on Sunday. According to our Elo ratings, which measure the strength of each NBA team and can be used to estimate the odds of victory when any two teams face off, the Lakers went into the game with a 6.5 percent chance of upsetting the Warriors. In the entire history of the league, thats only the 23rd-lowest pregame win probability for a team that won:

WINNER LOSER DATE TEAM ELO TEAM ELO SCORE CHANCE OF UPSET 1 4/24/93 Mavericks 1160 Rockets 1682 128-123 2.7% 2 4/6/93 Mavericks 1131 SuperSonics 1646 109-107 2.8 3 3/21/92 Magic 1288 Bulls 1782 111-108 3.2 4 3/21/90 Hornets 1235 Suns 1678 115-114 4.2 5 2/22/72 Pistons 1298 Lakers 1737 135-134 4.3 6 1/1/60 Royals 1320 Celtics 1728 128-115 5.1 7 4/16/14 76ers 1215 Heat 1620 100-87 5.2 8 12/1/94 Timberwolves 1235 Jazz 1634 96-94 5.4 9 2/13/98 Mavericks 1279 Pacers 1677 85-82 5.4 10 2/6/02 Bulls 1299 Lakers 1693 97-89 5.5 11 12/7/48 Steamrollers 1191 Royals 1583 90-89 5.6 12 2/18/12 Nets 1306 Bulls 1694 97-85 5.7 13 4/12/94 Mavericks 1210 Blazers 1597 108-107 5.7 14 12/29/85 Warriors 1361 Lakers 1747 130-122 5.8 15 3/27/81 Pistons 1303 Celtics 1679 115-90 6.1 16 4/16/14 Lakers 1357 Spurs 1732 113-100 6.1 17 11/4/80 Pistons 1281 Bucks 1656 98-96 6.1 18 11/23/67 SuperSonics 1267 Celtics 1641 133-106 6.2 19 4/13/15 Knicks 1249 Hawks 1619 112-108 6.3 20 2/18/72 76ers 1356 Bucks 1723 132-126 6.4 21 11/29/69 Pistons 1346 Knicks 1712 110-98 6.4 22 4/19/97 Grizzlies 1200 Suns 1566 121-107 6.4 23 3/6/16 Lakers 1259 Warriors 1823 112-95 6.5 24 11/29/09 Timberwolves 1285 Nuggets 1645 106-100 6.6 25 2/17/53 Bullets 1280 Lakers 1638 74-70 6.7 26 3/25/02 Grizzlies 1296 Blazers 1654 103-100 6.7 27 2/27/10 Nets 1237 Celtics 1595 104-96 6.7 28 2/2/93 Timberwolves 1281 Blazers 1637 104-91 6.8 29 4/8/08 Knicks 1302 Pistons 1657 98-94 6.8 30 2/9/07 Hawks 1374 Suns 1728 120-111 6.8 31 4/19/00 Clippers 1174 SuperSonics 1524 114-106 7.0 32 1/22/71 Hawks 1350 Bucks 1696 117-110 7.1 33 1/4/00 Grizzlies 1258 Heat 1601 91-87 7.2 34 1/18/91 Nets 1297 Celtics 1640 111-106 7.3 35 4/18/01 Bulls 1237 76ers 1579 92-86 7.3 36 11/23/90 Nets 1281 Suns 1621 116-114 7.3 37 4/11/99 Clippers 1282 Blazers 1622 89-83 7.4 38 1/23/72 Hawks 1374 Bucks 1714 118-113 7.4 39 4/16/12 Wizards 1335 Bulls 1675 87-84 7.4 40 4/12/89 Hornets 1228 Knicks 1566 104-99 7.4 40 biggest upsets in NBA history, by Elo Source: Basketball-Reference.com

A couple of times in April 1993, the disastrously bad Dallas Mavericks entered games with greater than a 97 percent probability of losing  and won! In those games, the Mavs averaged a win probability nearly three times lower than the Lakers had against the Warriors on Sunday. A couple of percentage points may not seem to matter much, but they add up when were talking about the likelihoods of extremely rare events.

Its also worth noting that LAs victory over Golden State is unique in one other important respect: The Lakers are the only home team on our list. Every other top-40 upset was pulled off away from a teams home court, which makes sense because home-court advantage is baked into the Elo formula. Starting the game on the road is a significant built-in disadvantage  between two otherwise evenly matched teams, Elo would expect the road team to win only 36 percent of the time  and, conversely, being at home is such an advantage that its difficult to be a very heavy underdog there. Theres a case to be made that this formulation shortchanges home underdogs by not giving them enough credit for their upset wins, but the gap between the Warriors and Lakers was so great that, even though LA was at home, it still managed to have a 93.5 percent likelihood of losing.

And somehow, the Lakers still won. Absurdly implausible results like that dont happen often in the NBA, but they still occur frequently enough to remind us that even the most unbeatable of teams has to lose every once in a while.",[]
