fivethirtyeight.com,2016-03-10 17:17:56+00:00,Why Am I Right-Handed?,['Maggie Koerth-baker'],"The questions kids ask about science arent always easy to answer. Sometimes, their little brains can lead to big places adults forget to explore. With that in mind, were starting a new series called Science Questions From a Toddler, which will use kids curiosity as a jumping-off point to investigate the scientific wonders that surround us all. I want the toddlers in your life to be a part of it! Send me their science questions and they may serve as the inspiration for a column. And now, our first toddler ...

Q: Why am I right-handed?  Josephine Kimball, age 5.

The short answer, dear Josephine, is that you are right-handed because most of humanity is right-handed. About 90 percent of us are righties  though the rate can vary by country and time period. Also, almost all the information we have on this comes from Western countries after the year 1900. As you grow up, you will learn to raise a mighty eyebrow at generalizations taken from such limited data. Sometimes, though, its all youve got.

Its pretty cool that you asked the question this way  why are people right-handed? When we adults talk about handedness, we tend to focus on the lefties. There are fewer of them, so we think theyre the strange ones. But the reality is that we dont know which is strange and which is not, because we dont really know what causes handedness at all. If there is an inherent biological tendency toward being right-handed, then yeah, the lefties are weird. But if theres not  and there might not be!  then its the righty majority whose existence becomes super confusing. Most of us think of handedness as simple and binary. Even scientists used to think the distinction between lefties and righties was mostly genetic. Turns out, thats wrong.

Heres what we do know: Humans are pretty asymmetrical creatures. That applies to both how we use the body parts we have and where things are in the first place. Our hearts tend to be on the left. Our livers tend to be on the right. Not only do these asymmetries exist, but some of them seem to be interconnected. People who are right-handed tend to process language on the left side of their brain.

Theres a way to see this connection: the Wada Test, a tool that doctors sometimes use to prepare people for brain surgery. First, you have your patient hold up both hands and talk. Then you inject a syringe full of barbiturates into her left carotid artery. (Please do not try this at home.) As soon as the drugs hit the left side of the brain and anesthetize it, 90 percent of right-handed people will lose control of their right hand, says William Hopkins, a professor of neuroscience at Georgia State University. Itll just drop into their lap, and theyll become unable to speak. But whats strange is that about 70 percent of left-handed people will also lose their language ability if you paralyze the left side of the brain. The rest are about evenly split between processing language on the right and processing it with both sides. Nobody knows why most righties are asymmetrical and most lefties arent.

That alone should tell you theres something a little weird about handedness. But scientists used to think it was a simple trait, easily explained. One of the most popular genetic models for handedness was proposed in 1985 by psychologist Chris McManus. Called the dextral/chance model, it proposed that handedness is determined by a single gene that comes in two varieties, dextral (D), meaning righty, and chance (C), meaning literally just chance. People who got a C variant from both parents would have a 50-50 chance of being lefties. The pairing of CD would take that chance down to 25 percent. People with DD would all be right-handed.

But in 2013, a paper published in the journal Heredity demonstrated that handedness had to involve more genes than that  a lot more. The researchers analyzed the genomes of 3,940 twins whose handedness was recorded from previous studies. First, they found that identical twins, who share all the same genetic material, werent significantly more likely to have the same dominant hand than fraternal twins, who are just regular siblings who shared a womb. That alone starts to rule out simple genetics.

Second, they failed to find any genes that stood out as connecting unrelated people who had the same dominant hand. If the genetics of handedness were simple, we ought to be able to look at the genomes of a bunch of unrelated righties and see a gene or genes they all shared. One of the co-authors was the same Chris McManus who first proposed the dextral/chance model. To John Armour, a professor of human genetics at the University of Nottingham in the U.K. and an author on the paper, thats a big deal. Its safe to say the simple models are out of date now, he told me.

On the contrary. I think the dextral/chance model is still the best explanation we have, McManus wrote in an email. The important thing is that there probably isnt a gene for left-handedness. Its still likely that we are dealing with genes that either make a person right-handed or leave her handedness to chance, the latter of which results in some left-handed people. All that has changed, McManus wrote, is that we now know this must involve many genes, rather than just one. He published a paper in 2013 that made this same basic point. Armour was one of his co-authors.

However Armour and McManuss debate hashes out, their research fits right in with a growing body of evidence, drawn from other studies of twins, that suggest genetics only accounts for about 25 percent of the variation in handedness. Some of these studies have involved as many as 30,000 sets of twins. If there were simple inheritance going on, that should be a big enough sample to show it. But Armour says researchers were still surprised by how little of the variation seems to be genetic.

To put it in context, blood groups (the immune system categories that determine who can take a blood transfusion from whom) are based on simple inheritance and are almost 100 percent attributable to genetics. Height is more complex, involving 300-odd genes, the most powerful of which accounts for only about 4 millimeters of growth, Armour told me. But even that is highly heritable. The numbers vary depending on the study, but scientists think 60 percent to 80 percent of your height comes from genetics. Body mass index, skin color, hair color, eye color  most obvious physical traits have high rates of genetic heritability. Sixty, 70 percent or above, Armour told me. Handedness is a distinct outlier.

So, if you arent right-handed because of your genes, what causes it? We know handedness can be affected by social forces. In most Western cultures, for instance, generations born at the beginning of the 20th century had left-handedness drilled (or sometimes beaten) out of them, says Tulya Kavaklioglu, a graduate student at the Max Planck Institute for Psycholinguistics who is studying the connections between handedness, language and genetics. She pointed to a study from 1981 on the prevalence of left-handed Australians. Among the study population, only about 2 percent of Australians born in 1880 were left-handed. Of the generation born in 1969, 13.2 percent were lefties. As it became more acceptable to be a lefty, Kavaklioglu says, more people were.

But culture doesnt totally explain it, either, Hopkins says. Human fetuses suck their thumbs in the womb, and almost all of them favor the right-hand digit, he told me. And theres a big debate over the hand our closest relatives prefer. Some researchers who have studied chimpanzees and other apes in the wild think that the chances of an individual ape being right-handed are about 50-50. Hopkins disagrees. That research counts a broad range of behaviors, from nose-picking to the hand an ape uses to touch a friend on the shoulder. His research narrows in on specific behaviors such as tool use, and it shows that apes, like humans, are mostly righties. The ratio of right-handed to left-handed chimps is lower than the ratio of right-handed to left-handed humans  2:1 as opposed to 9:1  but Hopkins told me he thinks the genetic determinant for apes might be stronger than it is in humans. In other words, humans are more likely to be right-handed than chimps, but chimps could be more likely to have inherited their handedness.

So is it nature or is it nurture? Its difficult to make all this evidence fit together in a way that makes sense. But Hopkins, Kavaklioglu and Armour say its easier if you understand this: Heritability isnt just about genetics. You are right-handed because of genes. You are right-handed because of culture. And you are right-handed because of other factors that affect you both before and after birth  things that can be heritable without being genetic.

Its not just your genes or what you explicitly learn. For instance, higher testosterone exposure in the womb is associated with increased rates of left-handedness, Kavaklioglu told me. Theres also implicit learning after birth, the kind that happens when babies watch and copy their parents behavior. Its possible, Hopkins says, that chimps and humans differ because human babies are born with less-developed brains. Theres more opportunity for our environments to turn a right-handed fetus into a left-handed child. Nobody knows for sure. But either way, handedness is a great example of how our perspective on genetics, as a whole, has changed. People used to think you could just hone in on the magic gene, Armour says. But weve come to appreciate that it can be more complicated than that.

Have your own science question from a toddler that you want answered? Send it in!",[]
fivethirtyeight.com,2016-03-10 19:18:40+00:00,Americans May Be Too Religious To Embrace Socialism,"['Andrew R', 'Paul A']","For over a century, scholars have wondered why the United States has never had a viable socialist movement. Socialist parties in other Western democracies, such as Britains Labour Party and Germanys Social Democratic Party, are regularly in and out of power, but the best socialist showing for president in the U.S. was Eugene Debss 6 percent in 1912.

Bernie Sanders has made socialism relevant again in this country. But will the U.S. join much of Western Europe in developing a successful socialist political tradition? Short of that, will the Sanders campaign ignite a new movement? Both are unlikely, at least for now, and a big part of the explanation why may lie in religion  religion inhibits socialisms spread and explains its lack of political mobilization.

To understand the relationship between socialist values and religion, we used the 2013 Public Religion Research Institutes Economic Values Study. As part of the survey, respondents were asked how much they agreed with a battery of statements regarding economic values, including It is the responsibility of the government to take care of people who cant take care of themselves, The government should do more to reduce the gap between the rich and poor and The government should guarantee health insurance for all citizens. We combined these into a socialism scale, the results of which suggest the average American is just left of center.

The conventional wisdom is that the individualist, evangelical style of American religion is a strong antidote to socialism. If faith alone can lead you to salvation, then efforts to reshape society are beside the point. But the animosity between them has been more pointed, especially regarding so called Godless communists who portrayed religion as the opiate of the masses. In these data, those who agreed that social problems would be resolved if enough people had a personal relationship with God were 20 percent less socialist than those who disagreed. A worldview that pits faith directly against collective action explains clearly why collectivist efforts have traditionally foundered in the U.S.

By the same token, Americans who are not religious (sometimes called the Nones) would be those most likely to hold socialist values. And indeed, this is what we find: Nones are 10 percent more socialist, on average, than religious Americans. The gap is greater among older people (15 percentage points at retirement age) and smaller among the young (5 percentage points at 18-24), perhaps because younger people are exposed to many more Nones and to greater economic insecurity than their elders. In what may be seen as a cruel irony given Sanderss difficulty with black voters, there is no such gap among nonwhite respondents  support for socialist values is high across the board. Even more, nonwhite respondents favor socialist values at equivalent levels as white Nones.

It seems that the Nones are key to socialisms fortune. While their growth in numbers may lead to more openness to socialist ideas, that is by no means certain. Nones are at a disadvantage in politics precisely because they lack religious affiliation: Churches are the most widespread social organizations in the U.S. Though not their primary purpose, churches connect individuals to political organizations and identities. Nones lack the organizational structure that helps connect their ideology to politics  in these data, 20 percent more young Nones are Independents than their religious peers, and they vote in very low numbers (about 12 percent in recent elections). Perhaps a portion of the lower than expected turnout among the young this nomination season can be attributed to the Nones.

Will socialism take hold in America in the near future? Though surveys continue to note majority support for socialist positions (especially among the young), its path is more difficult without the unifying and mobilizing force of religion.

For now, expect to see more of Hillary Clintons liberalism than Sanderss democratic socialism.",[]
fivethirtyeight.com,2016-03-10 20:37:06+00:00,Ted Cruz Might Still Be Able To Stop Donald Trump,['Nate Silver'],"The good news for the Republican establishment is that theres a man who might be able to stop Donald Trump. The bad news is that its Ted Cruz, someone they may dislike almost as much.

Cruz, who won Idaho on Tuesday while finishing second to Trump in Michigan, Mississippi and Hawaii, is within striking distance of Trump. So far, 29 percent of Republican primary voters have voted for Cruz as compared with 35 percent for Trump. Meanwhile, Cruz trails Trump by 100 delegates: not a trivial gap, although only one more than the 99 at stake in winner-take-all Florida next Tuesday.

The problem for Cruz is that Florida and the rest of the calendar probably arent as favorable to him as the states that have voted so far. (Florida looks like a Trump state as Marco Rubio loses ground.) But Cruz does have a few things going for him. Hes tended to outperform his polling almost everywhere. Hes won states in all four major regions of the country. And he potentially stands to gain if Rubio and perhaps John Kasich drop out.

The exit polls in Michigan and Mississippi asked voters who theyd pick in a two-way race between Trump and Cruz, also giving them the option to say theyd sit out the race. Among Rubio voters, on average between the two states, about 75 percent said theyd still vote in a Trump-Cruz race, and of those, 80 percent would prefer Cruz to Trump. Kasich voters were somewhat more equivocal; 55 percent said theyd still vote, and of those, two-thirds would go to Cruz over Trump. Although this is the first time the exit polls have asked about one-on-one matchups, the results are consistent with national polls showing Trump losing ground as the field winnows, as well as exit polls in previous states showing Trump being unpopular with Republicans who arent already supporting him.

What would the rest of the map (and more importantly, the delegate tally) look like in a potential two-way race between Trump and Cruz? Im not ready to predict that. Beyond Florida and Ohio, which vote on Tuesday, there isnt much polling in the other states. Nor has the Republican race been all that predictable along demographic lines, with Trump having performed well in states as diverse as Massachusetts, Alabama and Hawaii.

What I will do, however, is retrodict how the race might have gone had it been a two-man contest between Cruz and Trump all along. Could Cruz have beaten Trump in South Carolina, for instance? To do this, Ill redistribute support from Rubio, Kasich and other candidates to Cruz and Trump based on the exit poll answers I described above. To repeat, these assume that most of their support would have gone to Cruz but not all of it, and also that a fair number of voters (especially Kasich voters) would sit out the race without their candidate on the ballot.

Heres how things might have looked:

ESTIMATED SHARE OF VOTE DELEGATES UNDER UNIFORM GOP RULES DATE STATE TRUMP CRUZ TRUMP CRUZ Feb. 1 Iowa 40.7 59.3 5 23 Feb. 9 New Hampshire 57.3 41.0 18 4 Feb. 20 South Carolina 47.6 52.3 10 37 Feb. 23 Nevada 56.7 42.9 22 6 March 1 Alabama 55.4 42.4 37 10 Alaska 43.4 56.6 6 21 Arkansas 43.1 54.5 8 30 Georgia 50.7 48.0 55 17 Massachusetts 64.9 32.5 34 6 Minnesota 34.7 65.2 6 30 Oklahoma 38.5 60.0 8 33 Tennessee 50.3 47.4 42 13 Texas 34.1 62.7 24 123 Vermont 53.3 43.0 12 3 Virginia 49.9 48.9 32 15 March 5 Kansas 30.5 68.4 6 32 Kentucky 45.9 52.4 10 34 Louisiana 47.0 49.8 14 30 Maine 39.0 59.7 4 18 March 6 Puerto Rico 29.8 64.2 3 19 March 8 Hawaii 50.4 48.4 14 4 Idaho 34.4 62.4 5 25 Michigan 49.2 45.7 39 17 Mississippi 52.5 45.0 30 8 Total 444 558 Share of delegates 42% 53% What if Trump and Cruz had run one-on-one?

These figures estimate that Cruz would have won South Carolina, Arkansas, Kentucky and Louisiana in addition to the states where he already beat Trump. He also would have won Minnesota and Puerto Rico, which originally went to Rubio. Several other states, such as Michigan, Georgia and Virginia, would have been close between Trump and Cruz. Trump would be fairly dominant in the Northeast, however, and would still have won Nevada easily.

Overall, however, its likely that Cruz would have a delegate lead on Trump. I havent gone through each states delegate rules in detail, which would require estimating the vote by congressional district. Instead, Ive applied something I call uniform Republican rules, which I introduced in a previous article. These are simplified delegate rules that give one-third of the delegates to the winner in each state, with an additional bonus for finishing with more than 50 percent of the vote, and distribute most of the rest proportionately. (The uniform rules also assign a small number of unpledged delegates in each state; these are not shown in the table.) Basically, they represent a compromise between winner-take-all and proportional methods that roughly reflects the rules in the average Republican primary and that approximates actual delegate allocations reasonably well.

Under these rules, Cruz would have 558 delegates to 444 for Trump. So instead of trailing Trump by 100 delegates, hed lead him by roughly that amount instead.

This might sound too optimistic for Cruz, and certainly there are things a method like this cant account for. (If Cruz had won South Carolina rather than Trump, for example, it would have changed media coverage of the race.) But keep in mind that Cruz is doing most of the work himself  he hasnt trailed Trump by all that much in the states that have voted. So giving him even some of the Rubio and Kasich voters is enough to put him over the top in several states that he narrowly lost.

Perhaps we shouldnt be grouping Rubio and Kasich together, however. Whereas Rubios numbers have been going downhill in Florida and other places, Kasich is even money or maybe a little better to win Ohio. And if hes sustained himself this long on the basis of little more than a few second-place finishes in the Northeast, why would he drop out if he wins his home state?

The exit polls havent asked many questions about how supporters of the other candidates view Kasich, so well assume that Kasich gets about as many votes from Rubio as Cruz does. (This makes a certain amount of sense: Rubio supporters have more in common with Kasich voters demographically but more in common with Cruz voters ideologically.) Specifically, well assume that support from former Rubio voters goes 42.5 percent to Cruz, 42.5 percent to Kasich and 15 percent to Trump. Well also assume that 80 percent of them still vote, slightly up from 75 percent because weve given them another option. Kasich also gets to keep all of his own supporters, obviously. Heres how that would shake out:

ESTIMATED SHARE OF VOTE DELEGATES UNDER UNIFORM GOP RULES DATE STATE TRUMP CRUZ KASICH TRUMP CRUZ KASICH Feb. 1 Iowa 36.3 47.5 16.2 7 19 3 Feb. 9 New Hampshire 46.4 23.7 28.2 15 3 4 Feb. 20 South Carolina 41.9 37.8 20.2 30 11 6 Feb. 23 Nevada 53.1 33.3 13.2 23 5 0 March 1 Alabama 51.4 33.3 13.1 38 9 0 Alaska 40.2 48.4 11.4 8 19 0 Arkansas 39.7 44.0 13.9 12 26 0 Georgia 46.2 36.6 15.9 47 17 8 Massachusetts 54.5 17.3 25.6 32 3 5 Minnesota 30.1 48.6 21.3 7 24 5 Oklahoma 35.3 48.9 14.3 11 30 0 Tennessee 46.2 37.0 14.5 39 16 0 Texas 31.4 54.0 11.5 25 122 0 Vermont 37.9 18.7 39.7 4 2 9 Virginia 43.4 32.5 23.0 30 10 7 March 5 Kansas 26.2 55.8 17.0 5 30 3 Kentucky 39.2 38.5 20.7 27 11 6 Louisiana 43.8 42.6 10.4 30 14 0 Maine 34.1 49.4 15.2 5 15 2 March 6 Puerto Rico 25.5 38.6 30.0 4 14 4 March 8 Hawaii 45.2 38.2 15.5 11 5 2 Idaho 31.0 52.5 13.2 5 25 0 Michigan 38.4 28.6 27.9 35 11 11 Mississippi 48.4 38.4 10.6 27 11 0 Total 477 452 75 Share of delegates 45% 43% 7% Kasich could cost Trump votes but give him states

Kasich wins Vermont under this math, but thats the only state he gets. Meanwhile, the votes Kasich takes back from Cruz allow Trump to narrowly win South Carolina, Kentucky and Louisiana, when he would have lost them in a two-way race.

Overall, under uniform delegate rules, Trump wins slightly more delegates with Kasich running than without! Even though he wins fewer votes, the winner-take-all bonuses really help him. Cruz falls back behind Trump, meanwhile, while Kasich still isnt doing that well, with only 75 delegates to date.

So if Republicans want to stop Trump from being their nominee, they should encourage Kasich (along with Rubio) to drop his bid? Thats one reasonable interpretation of this data, yes. Trumps great weakness is that he loses ground as other candidates drop out. The most parsimonious strategy is just to get it to a one-on-one race.

However, I think the details make the case a bit more equivocal than that. Kasich could make a few good arguments for staying in the race:

O-H-I-O.

Southern states, Kasichs weakest region, are overrepresented so far.

Cruz is weak in the Northeast, and even if Kasich cant win those states, he might be able to prevent Trump from hitting winner-take-all thresholds in states like New York, where a candidate wins all statewide or congressional district delegates if he gets more than 50 percent of the vote.

Rubio voters probably wouldnt just split their votes 50-50; instead, they could behave tactically, going to Kasich in Connecticut (for example) but Cruz in Arizona.

Overall, I think its a close call between Cruz and Kasich having a better shot of stopping Trump as a tandem or Cruz being better off on his own. Kasich doesnt appear likely to drop out before Ohio, in any event, so what happens there will probably go a long way toward determining his plans.

Rubios chances are hanging by a thread, however. Hell presumably drop out if he loses Florida, but theres an argument that his chances are slim enough in Florida that anti-Trump Republicans would be better off if Rubio dropped out immediately, which would give Cruz and Kasich better chances to win delegates in Ohio, Illinois, Missouri and North Carolina, all of which also vote Tuesday.

Either way, theres likely to be some sort of endgame after March 15. Even if Trump wins both Ohio and Florida, Cruz might run relatively well against him in a one-on-one race from that point forward. Would it be too little and too late, especially with a lot of states in Trumps northeastern base still left to vote? Possibly, but Republican party elites would finally have to make the very choice they were most hoping to avoid.",[]
