fivethirtyeight.com,2016-03-09 21:52:54+00:00,Why The Polls Missed Bernie Sanderss Michigan Upset,['Carl Bialik'],"If Bernie Sanders were to defeat Hillary Clinton in Michigans Democratic primary, it would be among the greatest polling errors in primary history, our editor in chief, Nate Silver, wrote Tuesday evening when results started to come in. Sanders pulled it off, and now were left wondering how it happened. How did Sanders win by 1.5 percentage points when our polling average showed Clinton ahead by 21 points and our forecasts showed that Sanders had less than a 1 percent chance of winning?

With a polling miss this big, no single factor is likely to explain it, so more than one answer could be correct. Also, not every pollster releases detailed data, and it may take some time to fully diagnose what went wrong. Its a little bit of everything, Monmouth University pollster Patrick Murray told The Huffington Post.

Here is our initial assessment of some possible explanations, along with comments from some of the pollsters who had reported a big Clinton lead:

Pollsters underestimated youth turnout. Voters under 30 made up 19 percent of Democratic primary voters, nearly as large a share as voters 65 or older, according to exit polls. Mitchell Research and Communications, which showed a 37 percentage point Clinton lead in a poll conducted Sunday, found that people younger than 50 would make up less than a quarter of all voters; they made up more than half instead. Mitchell was one of the only pollsters in the state to poll using only calls to landlines, and most Americans younger than 45 live in households without landlines. But even Monmouth, which dialed cellphones, too, underestimated the turnout among younger voters. Perhaps all the polls showing a big Clinton lead sowed complacency among Clinton supporters, who skew older  though big leads in polls in Southern states didnt stop her supporters from helping her romp to big victories.

Pollsters underestimated Sanderss dominance among young voters. Not only did more young voters turn out than expected, but Sanders won 81 percent of 18- to 29-year-olds. A YouGov poll showed him winning 66 percent.

Pollsters underestimated the number of independent voters who would participate in the primary. YouGov expected Sanders to beat Clinton by 38 percentage points among independent voters participating in the open Democratic primary. He won those voters by 43 percentage points. But no one expected independents to make up 27 percent of voters; YouGov expected about 12 percent. There were too many Democrats in the poll, said Will Jordan, elections editor at YouGov.

Pollsters underestimated Sanderss support among black voters. Sanders had won less than 20 percent of black voters in most states with large black populations, and Mitchell and YouGov both showed Sanders winning less than 20 percent of them in Michigan. Instead he won 28 percent.

Pollsters missed a late break to Sanders by not polling after Sunday. Clinton and Sanders debated in Flint on Sunday and met in a town hall in Detroit on Monday. No public pollsters contacted voters after either event. Sanders did slightly better among voters who decided in the week before the primary, according to exit polls. An earlier polling miss, in the Iowa Republican caucuses, may have resulted in part from a scarcity of late polls. And there were signs before Sunday that Sanders was closing the gap: In the YouGov poll, 45 percent of Michigan Democrats said their opinion of Sanders was getting better, and just 8 percent said it was getting worse. For Clinton, the numbers were 38 percent and 19 percent.

Some Clinton supporters chose to vote in the Republican primary. We know 7 percent of voters in the Republican primary identified themselves as Democrats to exit pollsters, compared with just 4 percent of voters in the Democratic primary who said they were Republicans. Those 7 percent of Dems were likely mostly Hillary voters who thought she had an easy win and they could do their part trying to stop [Donald] Trump, said Bernie Porn of pollster EPIC-MRA. The exit-poll samples are too small, though, to check that.

Pollsters had little recent history to work with. Michigans Democratic primary was weird in 2008 (Barack Obama wasnt on the ballot), and the state party held caucuses in 2000 and 2004 that werent really competitive. So relying on voter history could lead pollsters astray. Remember, we havent had a real Democratic presidential primary in Michigan lately, said Matt Grossmann, director of the Institute for Public Policy and Social Research at Michigan State University, which showed the tightest race of any late polls, with Clinton leading by 5 percentage points.

This is an outlier, a perfectly rotten combination of bad luck and bad timing. Several pollsters pointed out that they used the same methods in the Michigan Democratic primary as in other primaries  including Michigans Republican primary  with relative success.

Polls on the Republican race, including ours, were generally OK, said Barbara Carvalho of the Marist Poll. She added that all polls on the Democratic race had Clinton winning. So, something clearly changed in the closing days.",[]
fivethirtyeight.com,2016-03-09 06:09:08+00:00,What The Stunning Bernie Sanders Win In Michigan Means,['Harry Enten'],"Bernie Sanders made folks like me eat a stack of humble pie on Tuesday night. He won the Michigan primary over Hillary Clinton, 50 percent to 48 percent, when not a single poll taken over the last month had Clinton leading by less than 5 percentage points. In fact, many had her lead at 20 percentage points or higher. Sanderss win in Michigan was one of the greatest upsets in modern political history.

Both the FiveThirtyEight polls-plus and polls-only forecast gave Clinton a greater than 99 percent chance of winning. Thats because polling averages for primaries, while inexact, are usually not 25 percentage points off. Indeed, my colleague Nate Silver went back and found that only one primary, the 1984 Democratic primary in New Hampshire, was even on the same scale as this upset. In that contest, the polling average had Walter Mondale beating Gary Hart by 17 percentage points, but it was Hart who won, with slightly more than 9 percentage points over Mondale.

Indeed, my initial thought was to compare the Sanders upset with Clintons over Barack Obama in the 2008 New Hampshire Democratic primary, but that undersells what happened Tuesday night. I was in New Hampshire when Clinton won in 2008 and sat in stunned disbelief  Obama lost by about 3 percentage points, when the polling average had him ahead by 8 percentage points. In other words, tonights error was more than double what occurred eight years ago.

The question I am asking myself now is whether this means the polls are off in other Midwestern states that are holding open primaries. Im talking specifically about Illinois and Ohio, both of which vote next Tuesday. The FiveThirtyEight polling average in Illinois gives Clinton a 37 percentage point lead, while the average in Ohio gives her a 20 percentage point lead. If Michigan was just a fluke (which is possible), then tonight will be forgotten soon enough. If, however, pollsters are missing something more fundamental about the electorate, then the Ohio and Illinois primaries could be a lot closer than expected.

Either way, this result will send a shock wave through the press. Heck, Im a member of the press, and you might be able to tell how surprised I am. This will likely lead to increased news coverage of the Democratic race, which Sanders desperately needs in order to be competitive next Tuesday and beyond.

Sanders must rack up big wins, and fast. Thanks to an 83 percent to 16 percent win in Mississippi, Clinton gained in the overall delegate count on Tuesday and leads Sanders by more than 200 pledged delegates. Her strong performance in Mississippi also put Sanders further behind his FiveThirtyEight delegate targets. That may not be as sexy as the tremendous upset in Michigan, but math is rarely sexy.

Sanders, however, can breathe a deep sigh of relief that all the states in the Deep South have already voted. He can hope that tonights Michigan win will help propel him to victory or at least make him more competitive in states with large delegate prizes left, like California, Florida, Illinois, New York, New Jersey, Ohio and Pennsylvania. Well see if it does.

Listen to the latest episode of the FiveThirtyEight elections podcast.

Subscribe: iTunes | Download | RSS | Video",[]
fivethirtyeight.com,2016-03-09 17:17:46+00:00,Religious Liberty Has Replaced Gay Marriage In GOP Talking Points,['Anne Li'],"It was so casual, the way Marco Rubio slipped same-sex marriage, unprovoked, into his closing statement at the Feb. 13 Republican debate.

We are going to be a country that says that life begins at conception and life is worthy of the protection of our laws, he said. Were going to be a country that says that marriage is between one man and one woman. We are going to be a country that says the Constitution and the rights that it talks about do not come from our president, they come from our creator.

In 2008, and especially in 2012, such a statement would not have surprised anyone. But this year, same-sex marriage no longer seems as prominent an issue in the GOP campaign. Though preserving and protecting traditional marriage remains in the official GOP platform, the Conservative Political Action Conference this month approved the Log Cabin Republicans as a conference sponsor after having been accused of discriminating against the pro-gay-marriage organization by rejecting their request to participate in previous conferences.

And in the Republican presidential debates, same-sex marriage and variations of that term have come up less frequently than they did in GOP debates during the 2012 and 2008 primary elections.

The chart above shows totals, but on average, gay marriage and its variants have only come up up 4.45 times per debate so far in this year. It came up 6.75 times per debate in 2012 and 5.13 times per debate in 2008.

Has the Republican Party all but given up on same-sex marriage? There seems to have been a shift since the Supreme Courts 2015 ruling that legalized same-sex marriage nationwide. But Gregory Angelo, president of the Log Cabin Republicans, says that the change started earlier  that the GOP learned from its mistakes in 2012, when the Republican electorate began to split on same-sex marriage. No longer a wedge issue that worked to the partys advantage, it became a divisive topic within the party, prompting this statement in its post-2012 election report: We need to campaign among Hispanic, black, Asian, and gay Americans and demonstrate that we care about them, too. Now, Angelo says, standing against gay rights will not win you many votes.

Just hours before the South Carolina primaries, he said, a robocall went over from a Ted Cruz super PAC that said if Donald Trump were president, you could expect forward motion on gay rights. Four years ago, eight years, ago, an ad like that could turn the dime.

Instead, Trump, who has flip-flopped on same-sex marriage several times, won the state primary, including 34 percent, a plurality, of the evangelical vote. His win may be due, in part, to rapid changes in the GOP electorate. According to the Pew Research Center, while evangelicals are the partys largest constituency nationwide, 14 percent of Republicans had no religious affiliation in 2014, up from 10 percent in 2007. And 61 percent of young Republicans support same-sex marriage. Paris Dennard, a GOP strategist, says more conservatives are leaning libertarian, meaning that they believe in limited government, even when it comes to gay marriage.

Not everyone has given up the marriage fight. But Russell D. Moore, president of the Ethics and Religious Liberty Commission, a unit of the Southern Baptist Convention that advocates Christian values to government leaders, acknowledges that the conversation has shifted.

Whatever their definition of marriage, he says, Americans should be concerned by the Supreme Courts decisions, both in terms of the power of the government and the reasons given for the redefinition.

I think thats where the conversation is now, he went on. What sort of justices and judges would a president appoint, and how would they be restricted by a constitution itself?

The shift from talking directly about same-sex marriage to more glancing references is also reflected in the GOP debate rhetoric. Mentions of religious, religious liberty and religious freedom appeared more than ever in this years debates when referring to the rights of business owners to refuse services to gay customers. Its code, Dennard says, for gay marriage.

What you can fight about is the ramifications of it, he said, that it affects small business, that it affects Christianity. What is the root issue? Christianity is under attack. You can say that values are under attack without coming out against gay marriage.

The shift has strategic significance, too. Gay marriage has long been a gateway issue, an important indicator for many voters as to whether the party shares their fundamental values. By standing against gay marriage, the party risks alienating new members.The shift is also, as Dennard notes, an indicator of how diverse the party really is.

You have people who are gay and in the party. The Republican Party is not a monolithic group. We are diverse, he said. But the question is, at the end of the day, who is going to be able to win, and how can you galvanize the people to feel a part of the party, while still maintaining an essence of the party?",[]
fivethirtyeight.com,2015-11-25 16:02:30+00:00,The Scientist Trying To Reverse Extinctions (Think Jurassic Park),[],"What if extinctions were only temporary? Yes, were talking Jurassic Park-level science. Its called de-extinction, and Dr. Mike Archer, a paleontologist, is trying to make it happen.

The Case for De-Extinction, the latest in the Collectors series from ESPN Films and FiveThirtyEight, follows Archer as he collects bones, DNA and the vital data of the extinct Tasmanian Tiger. Archer hopes that he can restore nature to a more pristine state. But, to paraphrase Ian Malcolm, even if we can bring back Eden, that doesnt mean we should.",[]
fivethirtyeight.com,2016-03-09 20:29:11+00:00,Elections Podcast: The Biggest Primary Polling Upset Ever,[],"We convene a special gathering of our elections podcast team to discuss Bernie Sanderss surprise victory in Michigan on Tuesday. By most measures, its the biggest polling miss in a primary in modern political history. But will the result in Michigan change the dynamics  or delegate math  of the Democratic race?

Subscribe: iTunes | Download | RSS | Video

You can stream or download the full episode above. You can also find us by searching fivethirtyeight in your favorite podcast app, or subscribe using the RSS feed. Check out all our other shows.

If youre a fan of the elections podcast, leave us a rating and review on iTunes, which helps other people discover the show. Have a comment, want to suggest something for good polling vs. bad polling or want to ask a question? Get in touch by email, on Twitter or in the comments.",[]
fivethirtyeight.com,2016-03-07 23:04:36+00:00,"USA Todays Embattled Crossword Puzzle Editor Is Stepping Back, For Now",['Oliver Roeder'],"The longtime editor of two major crossword puzzle series is temporarily stepping away from his editorial role, the puzzles publishers announced Monday, three days after FiveThirtyEight published an investigation into accusations of plagiarism against him.

The subject of the investigation, Timothy Parker, edits both the USA Today Crossword and the syndicated Universal Crossword. The copyright for both puzzles is owned by Universal Uclick (formerly the Universal Press Syndicate). According to an analysis of a newly completed database, 65 puzzles edited by Parker perfectly replicated themes and theme answers that were originally published in New York Times puzzles, with some using the same clues and grids. Hundreds more USA Today and Universal puzzles, edited by Parker, were re-published in those same two outlets with extremely minor changes and often under fake author names.

Since FiveThirtyEight published its initial article, USA Today and Universal Uclick have issued statements in response, and it appears that Parker is, for now, no longer in charge of either puzzle.

On Monday afternoon, Universal Uclick said the following:

Timothy Parker has edited thousands of puzzles for Universal over many years, and we have high regard for his work. So we are naturally very concerned by the recent story by FiveThirtyEight.com that puzzles he edited contained many similarities to puzzles edited by others. We are taking the allegations very seriously, and will explore them thoroughly and quickly. Until then, Tim has agreed to temporarily step back from any editorial role for both USA Today and Universal Crosswords. In the meantime, we are well prepared to immediately provide our customers crossword puzzles from a different source. We sincerely regret any inconvenience or concern this situation may have caused our clients and their readers.

Earlier Monday, USA Today published the following editors note:

USA TODAY is investigating claims made by FiveThirtyEight.com that crossword puzzles provided by Universal Uclick and edited by Timothy Parker were plagiarized from parts of puzzles that appeared in The New York Times. As we investigate, we will publish crosswords edited by other contributors.

The papers print-edition crossword on Monday listed no editor byline but did carry a Universal Uclick copyright credit. USA Todays online puzzle on Monday, however, still listed Parker as the editor. An email to USA Today asking who edited todays print puzzle was not immediately returned.

Read more: A Plagiarism Scandal Is Unfolding In The Crossword World",[]
fivethirtyeight.com,2016-03-09 21:51:09+00:00,Gonzaga Is A Major Team In A Minor Conference,['Neil Paine'],"Going into conference tournament week, the Gonzaga Bulldogs were no lock to extend their string of consecutive NCAA tourney berths to 18 years. To maintain the streak, the Zags probably needed to run the West Coast Conference tournament table, since an at-large bid was unlikely with seven losses on their resume. The automatic-bid route was how Gonzaga qualified for 13 of the previous 17 NCAA tournaments, but it wasnt even the conference favorite this year.

The streak, tied for seventh-longest in history, seemed to be in jeopardy.

Three victories later, the Bulldogs are West Coast champs and tournament-bound. Since its streak began in 1998-99, Gonzaga has been the best non-power-conference school, going by cumulative adjusted net efficiency:

ADJUSTED NET EFFICIENCY SCHOOL PRIMARY CONFERENCE WINS LOSSES TEAM OTHER CONF. MEMBERS DIFF 1 Gonzaga West Coast 484 117 +17.57 -0.34 +17.92 2 Memphis Conference USA 442 172 +14.84 +4.34 +10.50 3 Xavier Atlantic 10 355 145 +14.64 +4.11 +10.54 4 Butler Horizon League 356 136 +12.83 +0.34 +12.49 5 BYU Mountain West 395 185 +12.07 +4.48 +7.59 6 Temple Atlantic 10 373 222 +11.99 +4.56 +7.44 7 Creighton Missouri Valley 353 147 +11.62 +4.02 +7.60 8 Wichita St. Missouri Valley 373 208 +10.39 +3.72 +6.67 9 Dayton Atlantic 10 384 203 +9.54 +4.72 +4.82 10 UNLV Mountain West 371 201 +9.16 +5.34 +3.82 Best non-power-conference programs of the last 18 seasons SourceS: Ken Pomeroy, Daniel Myers

(Note that Im defining power conferences as the ACC, Big 8/Big 12, Big East  but not its offshoot the AAC, which has had the power ratings and total NCAA bids of a mid-major thus far  Big Ten, Pac-10/Pac-12 and SEC. I also filtered out teams like Cincinnati and Louisville that played fewer than three-quarters of their games in a non-power conference.)

As you might expect, Gonzaga towers over the other mid-majors. But even more striking might be the heights to which its risen over its fellow WCC members; as the Bulldogs were putting together the 12th-best rating of any program in the nation, the average non-Gonzaga WCC team has been worse than the average Division I school over the same span. Since 99, the Bulldogs have dominated their conference more than any other mid-major; second place (Butler) isnt especially close.

The same holds true if we expand beyond our admittedly selective endpoints and look at more than Gonzagas streak. Here are the top non-power teams of the 64-team NCAA Tournament era (since 1984-85):

ADJUSTED NET EFFICIENCY SCHOOL PRIMARY CONFERENCE WINS LOSSES TEAM OTHER CONF. MEMBERS DIFF 1 Memphis Conference USA 733 324 +13.61 +5.96 +7.65 2 Temple Atlantic 10 689 351 +13.37 +4.18 +9.19 3 Xavier Atlantic 10 640 267 +12.45 +2.95 +9.50 4 Gonzaga West Coast 689 279 +11.64 -0.47 +12.11 5 UNLV Mountain West 715 310 +11.33 +3.60 +7.74 6 Utah Western Athletic 531 289 +10.37 +4.11 +6.26 7 BYU Western Athletic 648 362 +9.52 +3.78 +5.74 8 New Mexico Mountain West 658 357 +8.47 +4.30 +4.17 9 Tulsa Missouri Valley 631 381 +8.19 +2.23 +5.96 10 Butler Midwestern Collegiate 554 323 +7.69 +0.48 +7.21 Best non-power-conference programs of the 64-team bracket era SourceS: Ken Pomeroy, Daniel Myers

Over this extended time period, the Zags are surpassed by Memphis, Temple and Xavier overall but remain the most dominant relative to the rest of their conference. On the one hand, this can be seen as Gonzaga beating the tar out of weak conference opponents. On the other, over more than three decades now, no mid-major has beaten the tar out of its conference the way Gonzaga has beaten down the WCC.",[]
fivethirtyeight.com,2015-12-16 16:21:19+00:00,The High School Football Coach Who Never Punts,[],"Never miss the best of FiveThirtyEight.

The best of FiveThirtyEight, delivered to you.

Thanks for submitting!

You should receive a confirmation in your inbox shortly.

Politics Dispatch

Our take on all things 2016. Significant Digits (Daily)

Our roundup of numbers in the news. What You Missed at FiveThirtyEight (Weekly)

Highlights from the past week.",[]
fivethirtyeight.com,2014-03-17 19:50:22+00:00,"Fear Not, Readers: We Have RSS Feeds",['Carla Correa'],"Update (March 28): Our readers have spoken, and we listened. We now have a catch-all RSS feed: http://fivethirtyeight.com/all/feed. This feed will deliver all FiveThirtyEight content.

The much-decried shutdown of Google Reader last summer didnt end the demand for RSS aggregation  especially among our core audience. Soon after the relaunch of FiveThirtyEight on Monday, tweets rolled in asking about RSS/ATOM feeds. Among them:

Love the new @FiveThirtyEight except for its apparent lack of a functioning RSS feed. :( http://t.co/awsuPTbm5L  Chad Skelton (@chadskelton) March 17, 2014

To help out sad Chad and his fellow FiveThirtyEight readers, heres a handy list of RSS feeds:

Features: http://fivethirtyeight.com/features/feed/

DataLab posts: http://fivethirtyeight.com/datalab/feed/

Politics features: http://fivethirtyeight.com/politics/feed/

Economics features: http://fivethirtyeight.com/economics/feed/

Sports features: http://fivethirtyeight.com/sports/feed/

Science features: http://fivethirtyeight.com/science/feed/

Life features: http://fivethirtyeight.com/life/feed/

Nate Silvers posts: http://fivethirtyeight.com/contributors/nate-silver/feed/

Note: The same format as Nates feed (first name-last name in the URL) can be used for all other FiveThirtyEight contributors.

Need an RSS reader? I like the smartphone- and tablet-friendly Feedly.",[]
