Source,Date,Title,Authors,Text,Keywords
cbs,,CSI: Crime Scene Investigation Video,[],"CSI: - The End Game

The CSI unit faces the final showdown with the Gig Harbor killer whose motives are finally revealed. Meanwhile, Nick Stokes makes a decision that will affect the entire team moving forward. Guest stars include Mark-Paul Gosselaar as Paul Winthrop, Mark Valley as Detective Daniel Shaw and Eric Roberts as Daniel Larson. (TV-14 D, S, V)",[]
cbs,,Blue Bloods Video,[],"Blue Bloods - No Regrets

When the same tragedy occurs to people who don't appear connected, Danny must find what they have in common and who is responsible. Meanwhile, Frank helps an old friend come to terms with his alcoholism. (TV-14 L, V)",[]
cbs,,The Brady Bunch Video,[],"The Brady Bunch - Dear Libby

Marcia reads a letter in the newspaper's ""Dear Libby"" column, wherein the recently married author is stressed out over a living arrangement similar to the Bradys'.",[]
cbs,,- CBS.com,[],"2/19 With time running out in Nevada, Hillary Clinton courted union workers in Las Vegas; 11yearold throws ""Thank You"" party for police Aired 02/19/16 18:30 EST",[]
cbs,,404 Page Not Found,[],"404: SORRY, THIS PAGE DOESN'T EXIST

You will shortly be redirected to our Watch page. If you are not automatically re-directed please click here.",[]
cbs,,Everybody Hates Chris Video,[],"Everybody Hates Chris - Everyone Hates Keisha

When Rochelle hires their young neighbor Keisha to tutor Drew in math, Chris sees this as his chance to impress the girl next door, but his plans go awry when Keisha makes her own moves.",[]
cbs,,Big Brother Video,[],"2/19 With time running out in Nevada, Hillary Clinton courted union workers in Las Vegas; 11yearold throws ""Thank You"" party for police Aired 02/19/16 18:30 EST",[]
cbs,,Under The Dome Video,[],"Under The Dome - Manhunt

When a former deputy goes rogue, Big Jim recruits Barbie to join the manhunt to keep the town safe. Meanwhile, Junior is determined to escape the dome by going underground. (TV-14 L, V)",[]
cbs,,Big Brother Video,[],"Big Brother - Episode 18

America's pick for the third nominee will be named and all three must battle it out in the Veto competition. (TV-PG L)",[]
cbs,,Star Trek: Enterprise Video,[],"Enterprise - Broken Bow, Part 1

The Enterprise crew sets on a maiden voyage with a mission to return a wounded Klingon to his people.",[]
