Source,Date,Title,Authors,Text,Keywords
msnbc,2016-02-19 13:45:00,Is Philadelphia testing its drinking water correctly?,['Lisa Riordan Seville'],"Philadelphias water passed its last round of lead testing with flying colors, but documents obtained by NBC News show those results may offer a misleading picture of the lead flowing from Philly taps.

A memo obtained by NBC News through a records request shows that in 2014 in a city with up to 50,000 homes with lead pipes, Philadelphia based its clean bill of health on sampling just 34 homes with lead pipes  fewer than required by law  while instead testing far more homes without lead pipes. After inquiries from NBC News, the Pennsylvania Department of Environmental Protection said it is now reviewing Philadelphias data.

Experts say the choice of houses, coupled with other flaws in the citys testing methods, may be offering Phillys residents false comfort about the quality of their water - and are a symptom of nationwide testing failures that may have masked lead problems in cities across the country, including Flint. Compared to some other U.S. utilities, Philadelphia Water has a reputation for being well-run and resourced.

I have the utmost respect for the folks in Philadelphia, and if this is whats going on in Philadelphia I shudder to think whats going on in the rest of the country, said Dr. Marc Edwards, a Virginia Tech researcher who was key to exposing the Flint lead crisis.

Close video Flint mayor ready to replace pipes as state, governor delay Mayor Karen Weaver of Flint, Michigan talks with Rachel Maddow about how she intends to commence with replacing the citys water pipes as early as next week as Governor Rick Snyder and the state legislature continues to drag their feet on funding and... embed like save share group

State and local officials are struggling to follow a federal regulation known as the Lead and Copper Rule thats designed to gauge whether a utility is properly treating its water to prevent corrosion of pipes that would leach heavy metals like lead into the water.

If 90 percent of homes tested register below the action level of 15 parts per billion of lead, the system is considered compliant. But testers are supposed to focus on high-risk homes, meaning older structures that have lead pipes or lead service lines in order to get a worst-case picture of the system.

Despite assurances by Flint and Sebring, Ohio, utilities that they were testing high-risk homes, neither was. Now officials in both towns are scrambling to address lead issues overlooked for months or years.

In a city like Philadelphia, which has old housing stock and thousands of lead pipes, the rule requires at least half the homes tested be high risk.

But documents obtained by NBC News show that Philadelphia Water was missing many high-risk homes, and getting test results from neighborhoods with relatively new, and therefore lower risk, homes. The percentage of high-risk homes tested had also dropped over time. The results show that the homes picked may determine whether the city seems to have safe water or seems to have a problem.

In 2002, 54 of the homes tested in Philadelphia were highest-risk Tier 1 homes, meaning they had lead pipes or copper pipes with lead solder laid just before the lead solder ban in 1986. In 2002, the city only tested a total of 63 homes, and only nine were low-risk.

Philadelphias all-important 90th percentile  the result that triggers its overall grade  came in at 13 parts per billion, just two points under the action level that requires utilities warn customers of the risk. Five lead-line houses that year tested high, as did one low-risk copper-line home.

By the following round of testing, three years later, most of the high-lead homes had dropped out of the testing pool. Since then, as the number of high-risk homes in the test group dwindled while the overall pool of tested homes grew, the citys results improved.

In 2014, Philadelphia tested just 34 homes with lead lines, and eight with high-risk lead solder. Those 42 high-risk homes made up less than a third of the 134 homes tested. That year, the citys 90th percentile had 5 ppb of lead in its water, well under the 15 ppb action level. Eight results tested high that year  three lead-line homes, and five lower-risk copper pipe homes.

The trend of choosing low-risk homes is combined with sampling instructions for test homes, first revealed in documents obtained by the Guardian, that may also skew the results downward.

Residents are told to remove their tap aerator and run their water the night before the test to flush out the line, known as pre-flushing, a practice that EPA water experts say can produce misleading results and has been used in other cities, like Flint.

RELATED: Parents of tragic 2-year-old with lead poisoning sue Flint

This clears particulate lead out of the plumbing and biases the results low, wrote EPA scientist Miguel Del Toral in a February 2015 email about Flints testing obtained by researchers at Virginia Tech. This practice provides false reassurance about the true lead levels in the water, he added.

Asked if Philadelphias method of choosing homes and pre-flushing could skew results, EPA water expert Mike Schock said, In my technical opinion, yes it would.

Philadelphia counters that its testing methods paint an accurate picture of a city where high lead is an anomaly, not the rule.

Its not clear that the way were taking samples is hiding problems, said Gary Burlingame, director of Philadelphia Waters Bureau of Laboratory Services. Could we be missing homes out there that have higher lead levels than others? Of course.

Utilities across the U.S. have told regulators about the challenges of meeting the federal rules demands. Cities must solicit volunteers for their water studies, and then ask the volunteers to run the tests themselves. In its memo to regulators, Philadelphia Water said it sent over 8,000 letters to customers, and only 134 had followed through the process.

People arent responding, said Burlingame, and often dont continue testing from one year to the next. Lead in water just hasnt been something thats been a national issue.

The state Department of Environmental Protection accepted Philadelphias results, and the citys argument that it was not able to get more high-risk homes. This despite the state agencys own guidance that, in accord with the federal rule that at least half of the homes tested in cities like Philly, with old homes and lots of lead pipes, should be high-risk.

RELATED: Hillary Clinton: There are too many Flints

The state also has guidance that any homes tested beyond the required number be high risk so as not to dilute the testing pool. Philadelphia was only required to test 50 homes in total, but tested 134  most of them low-risk. Burlingame said the utility tested the extra homes because it believed a larger pool would give a more accurate picture of the system.

He added that flushing the line was to clear any hot water from the tap. The federal rule is designed to test cold water, he said.

The DEP said that while half of homes tested should be high risk, sometimes a utility is not able to find enough high-risk homes. However, the agency said it is now reviewing the data submitted by Philadelphia.

The agency also said that Philadelphia had not diluted its pool in 2014, despite the extra homes in the sample, because more low-risk homes had tested high than high-risk homes.

The tier 3 [low risk] sample actually skewed the overall sample level higher, while still registering below action levels, the DEP said in a statement. Burlingame also said the city has seen problems in lower-risk homes in the past.

In addition, both the DEP and the EPA have issued explicit guidance telling utilities not to remove aerators when testing. But the DEP said it cant make utilities comply.

Both state and federal guidelines do recommend that aerators not be removed, said a DEP spokesperson. However, states cannot enforce recommendations or guidance.

Flaws in testing have not stopped officials across the country from trying to calm the fears of residents in the wake of Flint. Earlier this month, based on testing results from Philadelphia and more than 150 other state water utilities that came in under the action level, the state DEP told Pennsylvanians that drinking water is not the source of elevated lead levels found in some of the states children.

DEP Secretary John Quigley sent a clear message to the people of the state: DEP has regulations and programs in place to monitor lead levels in drinking water, and they are working.

This article originally appeared on NBCNews.com.","['homes', 'lead', 'pipes', 'testing', 'highrisk', 'philadelphia', 'results', 'water', 'tested', 'state', 'correctly', 'drinking']"
msnbc,2014-08-04 12:12:00,Tamron goes to jail (with the cast of OITNB),[],The cast of Orange Is the New Black give TODAYs Tamron Hall a guided tour of the set of the Emmy-nominated Netflix show.,"['set', 'todays', 'netflix', 'guided', 'emmynominated', 'cast', 'tour', 'jail', 'oitnb', 'goes', 'orange', 'tamron', 'hall']"
msnbc,2016-02-22 09:45:00,First Read: It's a three-man Republican race,[],"First Read is a morning briefing from Meet the Press and the NBC Political Unit on the days most important political stories and why they matter.

Its a three-man Republican race view photo essay Photos: South Carolina's Republican presidential primary Republican presidential candidates have been campaigning across the Palmetto State in anticipation of its first-in-the-South GOP primary.

After three Republican nominating races in the books, we have a three-man contest  among Donald Trump (the winner of New Hampshire and South Carolina), Ted Cruz (the winner of Iowa), and Marco Rubio (the narrow second-place finisher in South Carolina). The exit poll from Saturdays South Carolina primary underscores this three-man race: Trump overwhelmingly won among Republicans who want a candidate who can bring needed change and who tells it like it is; Cruz won among Republicans who want a candidate who shares my values; and Rubio won among those who want someone who can win in November. So thats your GOP race  Mr. Change, Mr. Values, and Mr. Electability. And all three of them have challenges heading into Super Tuesday. Can Trump continue to win as the GOP field gets smaller? (How he performs in Cruzs Texas will be instructive.) Can Cruz broaden his appeal with Republican moderates? (He got just 7% from moderates, according to the South Carolina exit poll, and finishing third in South Carolina is a troubling sign for his longer-term growth.) And can Rubio finally win a race? (Hes the only one of the three without a gold medal.)

But Trump is your big favorite

Yet if its a three-man race, Donald Trump is your heavy favorite. Think about it: If anyone else had won New Hampshire and South Carolina in back-to-back contests  like John McCain did in 2008  youd say the race is over. Well, this race isnt over, but Trump is playing with house money. If he wins in Texas on March 1, or wins in Florida on March 15, its done. And the way he won South Carolina, grabbing all of the states 50 delegates by winning just 33% of the overall vote, demonstrates how he can build a significant delegate lead come March 1.

The establishment rallying around Rubio begins

With Trump now the clear Republican frontrunner, GOP establishment types are already rallying around Rubio. NBCs Leigh Ann Caldwell: Bobbie Kilberg and her husband Bill, bundlers who first backed New Jersey Gov. Chris Christie and then signed on to Bushs campaign in the waning days, have decided to back Rubio. He is now the candidate around whom mainstream Republicans can coalesce, Kilberg told NBC News. But Rubio encounters two significant hurdles in a race against Trump  immigration (where its impossible for him to get to Trumps right on the issue) and special-interest money (with Trump eager to tell audiences how Rubio will owe his big contributors).

Kasich and Carson are still playing a role by staying alive

With the GOP contest now a three-man race, that doesnt mean you should ignore the other two Republicans still running  John Kasich and Ben Carson. If Kasich is able to have enough money to survive two or three more weeks of campaigning, he could be a player in Michigan (March 8) and his home state of Ohio (March 15), which would hurt Rubio in those two states. And even though he finished sixth in South Carolina, Carson still captured 7% of the vote, which could potentially be going to someone else (Cruz? Trump?).

I feel like the Republican Party as I know it suspended its campaign

After his disappointing fourth-place finish in South Carolina, Jeb Bush suspended his campaign. And more than anything else, it emphasized how todays Republican Party is no longer the party that Bushs brother once led or that featured Bush as one of the countrys most conservative governors in the early 2000s. MSNBCs Benjy Sarlin: This was a candidate who stood for an entire generation of Republican Party building, who was the figurative and literal heir to the family brand that had graced nearly every GOP ticket for a generation. And he ceded the race to a candidate whose campaign was a walking insult to his family legacy and everything Bushs supporters told themselves the party stood for. I feel like the Republican Party as I know it suspended its campaign tonight, said Lee Spieckerman, a Texas commentator who had knocked on doors for Bush in New Hampshire and in South Carolina.

You say you want a revolution?

Hillary Clintons victory in Nevada on Saturday was a big sigh of relief for her campaign, and it now gives her the ability to start pulling away in the delegate race  with the contests in South Carolina and the March 1 states (like Alabama, Arkansas, Georgia Tennessee, Virginia) coming up. Beyond keeping up in those contests, Bernie Sanders now faces this challenge: How does he convince Democratic voters that he truly is inspiring a revolution. Just look at these turnout numbers in the first three states:

Iowa 2008: 239,972

Iowa 2016: 171,109

New Hampshire 2008: 288,672

New Hampshire 2016: 250,983

Nevada 2008: 120,000

Nevada 2016: 80,000

As Sanders said on Meet the Press yesterday, The voter turnout was not as high as I had wanted. And what Ive said over and over again, we will do well when young people, when working-class people come out. We do not do well when the voter turnout is not large. But what happens when that turnout isnt as high as 1) whats happening in the GOP race, and 2) what happened in the Dem race in 2008? Thats an important question for Sanders and his supporters to answer. If youre promising a revolution, dont people have to come out  more than in 2008, more than what were seeing on the GOP side  for that revolution to be successful?

Feeling the burn rate: Sanders also has a structural challenge

Hes raising a lot of money ($21 million in January), but hes also spending like a general-election nominee ($35 million). That amounts to a 164% burn rate, and its why his cash on hand is less than half of the size as Hillary Clintons. Here are the Jan. 2016 fundraising numbers:

Raised in January

Sanders: $21.3 million

Clinton: $14.9 million

Cruz: $7.6 million

Trump: $6.1 million

Rubio: $4.9 million

Carson: $3.8 million

Bush: $1.6 million - OUT OF RACE

OMalley: $1.2 million - OUT OF RACE

Kasich: $1 million

Christie: $837K - OUT OF RACE

Fiorina: $499K - OUT OF RACE

Huckabee: $166K - OUT OF RACE

Santorum: $123K - OUT OF RACE

Cash on hand (through Jan. 31)

Clinton: $32.9 million

Sanders: $14.7 million

Cruz: $13.6 million

Rubio: $5 million

Carson: $4.1 million

Fiorina: $3.3 million

Bush: $2.9 million

Trump: $1.5 million

Kasich: $1.5 million

Christie: $742K

OMalley: $176K

Huckabee: $39K

Santorum: $29K

January burn rates for candidates still in race

Rubio: 208%

Kasich: 199%

Trump: 188%

Cruz: 167%

Sanders: 164%

Carson: 163%

Clinton: 134%

On the trail

Bill Clinton stumps in Laredo and Dallas, TX... Bernie Sanders hits Amherst, MA... Donald Trump holds rallies in Elko and Las Vegas, NV... Ted Cruz also campaigns in Nevada... Ditto Marco Rubio... And John Kasich is in Virginia.

Countdown to GOP Nevada caucuses: 1 day

Countdown to Dem South Carolina primary: 5 days

Countdown to Super Tuesday: 8 days","['trump', 'won', 'read', 'rubio', 'race', 'party', '2008', 'republican', 'threeman', 'gop', 'south', 'carolina']"
msnbc,,Lockup Extended Stay: Sacramento  Taming Wild,"['All In With Chris Hayes', 'Msnbc Live With Jos D Az-balart', ""The Last Word With Lawrence O'donnell"", 'Msnbc Live With Thomas Roberts', 'Melissa Harris-perry', 'Msnbc Live', 'Msnbc Live With Kate Snow', 'The Docket', 'Weekends With Alex Witt', 'The Rachel Maddow Show']","The Sacramento County Sheriffs Department has developed a program where inmates can train wild horses and learn new skills under the expert eye of ranch director Joe Misner. Tune into MSNBC on Saturday at 10pm ET/7pm PT to catch the all-new Lockup Sacramento episode.

... more

Duration: {{video.duration.momentjs}}","['lockup', 'program', 'extended', 'pt', 'skills', 'sacramento', 'ranch', 'sheriffs', 'stay', 'taming', 'videodurationmomentjs', 'train', 'wild', 'tune']"
msnbc,2016-02-21 14:15:00,RNC chair on brokered convention: 'We're prepared for anything',[],"Donald Trumps first-place finish in South Carolina has revived an ongoing discussion about the possibility of a brokered Republican convention, the prospect of which became a central question as the candidates made the rounds of the post-primary Sunday shows.

The business mogul toppled his rivals in the Palmetto State with 33 percent of the vote. Sen. Marco Rubio, his nearest competitor, came in 10 percentage points behind him and barely overtook Sen. Ted Cruz for second place. Trumps victories in South Carolina and New Hampshire, as well as his second-place finish in Iowa, give him a decisive lead in the delegate count and establish him as the clear front-runner going into the February 23 Nevada caucus  a scenario that has sent some Republicans into a panic.

When asked by Jake Tapper on CNNs State of the Union if party leaders do not take Trump seriously despite his strong showings, Trump pointed to his status as an outsider.

All of the establishment sort of said, Well, wait a minute. What happened to him? Hes not supposed to be doing that. Thats not in the cards, Trump said of his presidential bid. I dont want money. You know, Im self-funding my campaign, so I dont need donor money and lobbyist money and special interest money. And that bothers them because the special interests want to control their candidates, and I cant be controlled.

RELATED: Jeb Bush leaves behind a party he can barely recognize

Some on the right have argued that if the GOP field does not consolidate behind one or two alternative candidates in the coming weeks, the chances of Trump winning the nomination or the GOP having a brokered convention would increase dramatically. However, Trump dismissed the notion of a brokered convention, which would occur if no candidate has the required amount of delegates to secure the nomination. The Republicans would then take the battle to the convention floor to decide on a nominee in July.

I dont think were going to have a convention, a brokered convention. I think its unlikely. I think Im doing better than that. And so far, you know, Im really on my way, Trump told Tapper. I thought I actually won Iowa if you look at it really closely. But even if I didnt, I just got one delegate less because I came in a very, very close second. So I have a second and I have two firsts. And New Hampshire was a blowout, and this one was a blowout.

Despite telling reporters earlier this month that his campaign was planning for a race that could go to the convention floor, Marco Rubio on Sunday also dismissed talk of a brokered convention while decrying party insiders.

I dont think its likely. I think the voters are going to decide it. I most certainly dont want party insiders deciding this, because if party insiders had been the ones deciding this nomination, I wouldnt be standing. I wouldnt be here right now doing this interview with you, Rubio said in an interview with Tapper. I wouldnt have even been in the Senate, for that matter. They didnt want me in the Senate.

On ABCs This Week, Republican National Committee Chairman Reince Priebus denied that Trumps rise was an indictment of the party leadership. Priebus also insisted that the RNC would support whomever the eventual nominee is, even as Trump continues to claim that the committee is treating him unfairly.

I think its early in the process, but certainly when the time comes and when were sitting either before Cleveland or at Cleveland or whenever that point may come, and we have a presumptive nominee, what will happen is the RNC will join in with that nominee, and we will put together the biggest, which weve already started doing, the biggest ground game and data operation that weve ever seen, Priebus said.

When asked if the RNC was planning for a brokered convention, Priebus said he doubted that one would occur but that the party leadership would be ready if necessary.

Planning can mean a lot of things. Were prepared for anything. I was general counsel for two years before I was chairman of this party, Ive been chairman for six years. I dont think there are too many people that are more familiar with the procedures of nominating someone at a convention than I am, Priebus told George Stephanopoulos. So Im prepared, and we will be prepared if that happens, but again, I dont think thats going to be the case. If it did, then of course, obviously, it would be pretty historic. But well be ready.","['brokered', 'trump', 'nominee', 'rnc', 'money', 'priebus', 'prepared', 'im', 'convention', 'party', 'chair', 'think', 'dont']"
