Source,Date,Title,Authors,Text,Keywords
msnbc,2016-02-10 09:23:00,Supreme Court conservatives block Clean Energy Plan,[],"Much of the political world was focused late yesterday on the New Hampshire presidential primaries, and for good reason: the nations future direction will be shaped in large part by who wins the White House.

But away from the Granite State, Americans received a very different kind of reminder about whats actually at stake in 2016. NBC News Pete Williams reported :

The U.S. Supreme Court on Tuesday blocked enforcement of the Obama administrations ambitious new plan for cutting greenhouse gas emissions from power plants. The justices granted a plea from 30 states that asked for a temporary hold on the new Clean Energy Plan while the lower courts decide whether the Environmental Protection Agency has the legal authority to impose it.

This was ... wait for it ... a 5-4 decision. The courts Republican-appointed conservatives  Justices Scalia, Thomas, Alito, Kennedy, and Roberts  agreed to block the energy policy, while the courts Democratic-appointed center-left justices  Ginsburg, Breyer, Sotomayor, and Kagan dissented.

A New York Times report noted that there is no precedent for the high court taking a step like this: the Supreme Court had never before granted a request to halt a regulation before review by a federal appeals court. Jody Freeman, a Harvard law professor and former environmental legal counsel to the Obama administration, described the move as stunning.

To appreciate why, l ets pause for a moment to consider how we reached this point.

As regular readers may recall , in June 2014, President Obama unveiled an ambitious plan to reduce carbon pollution from existing power plants, setting reduced emissions limits. Under the plan, the White House offered states some flexibility in how they reach the target: the Obama administration was less concerned with how states cut carbon pollution and more concerned with the end goal. How states got there was up to them.

A total of 27 states balked, saying they not only want to ignore the crisis, but they also believed the Obama administration lacked the authority to impose these requirements. The White House pointed to the Clean Air Act, approved by Congress, to insist the authority most certainly exists.

The D.C. Circuit Court of Appeals  generally considered the nations second highest court  has agreed to hear the case, but it left the policy in place as the legal proceedings continued. Yesterday, five Supreme Court justices intervened  for the first time in American history  to block the implementation of the policy before the appeals court even hears arguments in the case.

Voxs Brad Plumer added , This isnt a fatal blow for Obamas climate rule, but its not a great sign. It suggests that five justices on the Supreme Court have some serious doubts about the Clean Power Plan.

In the meantime, the courts conservative majority offered a powerful and timely reminder to voters about whats on the line in the 2016 election. Readers are going to get tired of seeing me write this , but three current justices will be at least 80 by Inauguration Day 2017. Ginsburg will be 83. A fourth, Breyer, will be 78. The average retirement age: 78.7","['supreme', 'court', 'justices', 'power', 'energy', 'states', 'courts', 'plan', 'clean', 'conservatives', 'policy', 'white', 'block', 'obama']"
msnbc,,Rep. Clyburn: My heart has always been with Clinton,"['All In With Chris Hayes', 'Andrea Mitchell Reports', 'Msnbc Live With Thomas Roberts', 'Msnbc Live', 'Weekends With Alex Witt', 'The Rachel Maddow Show', 'Msnbc Live With Tamron Hall', 'Morning Joe']","South Carolina Congressman Jim Clyburn joins Tamron Hall to discuss his recent endorsement of Hillary Clinton. Rep. Clyburn explains what he meant by saying his head and heart were conflicting with each other for who to endorse.

... more

Duration: {{video.duration.momentjs}}","['meant', 'heart', 'clinton', 'saying', 'rep', 'clyburn', 'videodurationmomentjs', 'joins', 'moreduration', 'tamron', 'south', 'recent']"
msnbc,,Rapper Bun B covering election for VICE.com,"['All In With Chris Hayes', 'Andrea Mitchell Reports', 'Msnbc Live With Thomas Roberts', 'Msnbc Live', 'Weekends With Alex Witt', 'The Rachel Maddow Show', 'Msnbc Live With Tamron Hall', 'Morning Joe']","Legendary hip hop artist Bernard Bun B Freeman who is covering the 2016 election for VICE.com as a political correspondent, joins Tamron Hall to discuss his time on the campaign trail.

... more

Duration: {{video.duration.momentjs}}","['hip', 'b', 'hop', 'joins', 'covering', 'political', 'rapper', 'tamron', 'trail', 'videodurationmomentjs', 'bun', 'election', 'legendary', 'moreduration', 'vicecom']"
msnbc,,Hollywood gets low grade in diversity: study,"['All In With Chris Hayes', 'The Rachel Maddow Show', 'So Popular', 'Code Forward', 'Msnbc Live With Thomas Roberts', 'Way Too Early', 'Melissa Harris-perry', 'Hardball With Chris Matthews', 'Msnbc Live', 'Weekends With Alex Witt']","Two new reports slam diversity in Hollywood productions. Jonathan Capehart has the details.

... more

Duration: {{video.duration.momentjs}}","['jonathan', 'diversity', 'grade', 'study', 'capehart', 'videodurationmomentjs', 'slam', 'productions', 'low', 'reports', 'moreduration', 'hollywood', 'gets', 'details']"
msnbc,,I looked across the table at dictators and...,"['Style Hatch - Http Stylehatch Co Stylehatch', 'Site Authors']","About

The destination for in-depth analysis of daily headlines, insightful political commentary and informed perspectives. Find more information on MSNBCs programming at msnbc.com.

Follow our other Tumblrs:

The Rachel Maddow Show

PoliticsNation

The...","['perspectives', 'maddow', 'msnbcs', 'programming', 'rachel', 'political', 'showpoliticsnationthe', 'dictators', 'msnbccomfollow', 'looked', 'tumblrsthe', 'table', 'insightful']"
msnbc,,All In 2/19/16,"['All In With Chris Hayes', 'Msnbc Live With Thomas Roberts', 'Msnbc Live', 'Weekends With Alex Witt', 'The Rachel Maddow Show', 'Msnbc Live With Tamron Hall', 'Morning Joe']",,['21916']
msnbc,,Rep. Clyburn endorses Hillary Clinton,"['All In With Chris Hayes', 'Andrea Mitchell Reports', 'Msnbc Live With Thomas Roberts', 'Msnbc Live', 'Weekends With Alex Witt', 'The Rachel Maddow Show', 'Msnbc Live With Tamron Hall', 'Morning Joe']",,"['rep', 'endorses', 'clinton', 'hillary', 'clyburn']"
msnbc,,Sanders on affordable child care,"['Morning Joe', 'All In With Chris Hayes', 'Msnbc Live With Thomas Roberts', 'Weekends With Alex Witt', 'The Rachel Maddow Show', 'Msnbc Live With Tamron Hall', 'Msnbc Live']","Democratic presidential candidate Bernie Sanders talks about the importance of quality affordable child care during the MSNBC Clinton-Sanders town hall. Sanders vows to tax big corporations and the wealthy in order to finance affordable child care and assistance for families.

... more

Duration: {{video.duration.momentjs}}","['affordable', 'sanders', 'vows', 'town', 'wealthy', 'tax', 'videodurationmomentjs', 'child', 'talks', 'care']"
msnbc,,'Wake the Vote' students work on 2016 campaigns,"['All In With Chris Hayes', 'Andrea Mitchell Reports', 'Msnbc Live With Thomas Roberts', 'Melissa Harris-perry', 'Msnbc Live', 'Weekends With Alex Witt', 'The Rachel Maddow Show', 'Msnbc Live With Tamron Hall', 'Morning Joe']","""Wake the Vote"" is a full year, deep immersion, civic engagement program where students learn about American elections by taking part in them. Erica Jordan, Cam Migdol, Ryan Wolfe and Camry Wilborn discuss their experience in the program.

... more

Duration: {{video.duration.momentjs}}","['wolfe', 'students', 'taking', 'work', 'ryan', 'campaigns', 'videodurationmomentjs', 'program', 'wake', 'moreduration', 'vote', 'wilborn', '2016']"
msnbc,2016-02-22 13:42:00,"Rubio knocks Cruz for 'dishonest' tactics, but avoids Trump",['Alexandra Jaffe'],"LAS VEGAS  Marco Rubio is keeping up the heat on Ted Cruz, suggesting he should fire someone for what he called a pattern of deceptive and untrue tactics and comments coming from Cruzs campaign.

But at the same time, hes continuing to avoid attacking the GOP front-runner, Donald Trump, even as he claims the fight for the nomination has narrowed to a three-man race.

Speaking to reporters before departing on his charter for a three-stop tour of Nevada on Monday, Rubio said with Cruzs campaign, were now at a point where we start asking about accountability. You talk about the VA, where people who arent doing their job need to be fired well, whos going to be fired when Ted Cruz is president? Because this campaign now has repeatedly done things that they have to apologize for and no ones ever held accountable.

His comments came in response to a video circulated by Cruz backers over the weekend that claimed  erroneously  to show Rubio telling Cruzs father, Rafael, and one of his staffers that there arent many answers in the Bible. The chance encounter between Rubio and the Cruz contingency was caught on-film and someone incorrectly transcribed the interaction in on-screen text, and Cruz spokesman Rick Tyler posted it on his Facebook page.

view photo essay The presidential campaign: Marco Rubio Because of his youth and relatively moderate campaign rhetoric, Rubio is often touted as the Republican Partys best hope of appealing to younger voters.

Rubio told reporters that he had actually told the Cruz staffer that the answer to every question youll ever have is in that book - and then I pointed to the Book of Proverbs, which he was reading, I said, particularly that one, which is the book of wisdom.

And then for them to take a video and to transcribe words on it that are the complete opposite of what I said  its incredibly disturbing, he said.

The Cruz campaign ultimately chalked the video up to a misunderstanding, and Tyler apologized for it. Rubio said he accepted the apology but ticked off the recent controversies dogging Cruz over his campaign tactics  his staffers telling Iowa voters Ben Carson had dropped out; controversial robocalls allegedly coming from the senators campaign in South Carolina and an ad attacking Rubio on cap and trade that South Carolina networks eventually took off-air because it misstated the facts  and said the latest video was part of a very disturbing pattern of deceptive campaigns or flat-out just lying.

Its a continuation of an attack Rubio first launched in Iowa, where he accused Cruz of saying or doing anything to get elected, and ramped up in South Carolina after Cruz and Rubio each exchanged charges the other was lying at the last GOP debate.

Rubios campaign kept up the scrutiny on Cruz through the weekend, issuing a call last Friday for their supporters to keep an eye out for dirty tricks from the Cruz campaign. And it wasnt just Rubio accusing Cruz of dishonesty  Donald Trump took up the charge as well, amplifying the message and contributing to a drop in Cruzs popularity over the past week that ultimately helped Rubio gain a slight edge over him in the South Carolina primary.

Rubios second-place finish spurred Jeb Bush to drop out of the race, helping to consolidate the GOP primary into a largely three-man battle between Rubio, Cruz and Trump. But where Rubio hasnt shied away from attacking Cruz, hes been reluctant to take aim at Trump, avoiding every opportunity to criticize the front-runner  to the chagrin of some in the GOP.

On Monday, he again toed that cautious line. Asked if he agreed with a new ad from a super PAC supporting his bid that called Trump erratic, unreliable, Rubio said he hadnt seen the ad and declined to comment on its substance. And while he raised doubts about his foreign policy understanding, Rubio still gave Trump the benefit of the doubt on that issue.

I have said that when it comes to issues of national security, Donald has yet to prove that he has an in-depth understanding or the judgment to make good decisions about that  that could change, he said.

This story first appeared on NBCNews.com.","['cruzs', 'tactics', 'trump', 'campaign', 'dishonest', 'rubio', 'cruz', 'video', 'donald', 'avoids', 'knocks', 'gop', 'south', 'carolina']"
msnbc,,Joe: I have bad news for GOP establishment,"['All In With Chris Hayes', 'Andrea Mitchell Reports', 'Msnbc Live With Thomas Roberts', 'Morning Joe', 'Weekends With Alex Witt', 'The Rachel Maddow Show', 'Msnbc Live With Tamron Hall', 'Msnbc Live']","Top Talkers: Following Donald Trump's win in South Carolina and Jeb Bush's announcement, the Morning Joe panel assesses the current state of the 2016 GOP field to see what's next.

... more

Duration: {{video.duration.momentjs}}","['whats', 'state', 'win', 'talkers', 'morning', 'videodurationmomentjs', 'bad', 'joe', 'moreduration', 'panel', 'establishment', 'gop', 'south', 'trumps']"
msnbc,,Clinton college plan to include DACA students,"['Morning Joe', 'All In With Chris Hayes', 'Msnbc Live With Thomas Roberts', 'Weekends With Alex Witt', 'The Rachel Maddow Show', 'Msnbc Live With Tamron Hall', 'Msnbc Live']","Hillary Clinton takes a young voter's question about her debt-free college plan, stating that even DACA and other undocumented students also deserve the same opportunities to education.

... more

Duration: {{video.duration.momentjs}}","['clinton', 'takes', 'voters', 'students', 'daca', 'question', 'young', 'opportunities', 'undocumented', 'college', 'plan', 'videodurationmomentjs', 'include', 'stating']"
msnbc,2016-02-21 17:44:00,129 killed in Syrian bombings  as Kerry announces 'provisional' truce,"['Abigail Williams', 'Alex Johnson']","A bloody spasm of violence was reported to have killed almost 130 people Sunday in Syria as the United States announced that it and Russia had reached a provisional agreement on a cease-fire in the civil war-torn country.

The official Syrian news agency SANA said 83 people were killed and 178 others were wounded in three bombings near a Shiite shrine in Damascus.

Meanwhile, the Syrian Observatory for Human Rights said 46 people were killed by two suicide bombers in the al-Zahraa neighborhood of Homs. At least 28 of the victims in Homs were civilians, said the observatory, a British-based human rights watchdog that is widely considered to be authoritative.

SANA said ISIS claimed responsibility for the bombings near Damascus, which it described as a car bomb explosion followed by two suicide bombs in the area of the Shiite shrine of Sayyida Zeinab. It said most of the injured were women and children.

The violence came on the same day that U.S. Secretary of State John Kerry said Washington and Moscow had negotiated a provisional deal on a truce in Syrias civil war.

RELATED: Syrias Assad: Ready for truce if terrorists dont exploit it

World powers, which have been pushing for a halt in Syrias nearly five-year civil war, had hoped to see a truce take effect on Friday but have struggled to agree on the terms.

Kerry said in remarks in Amman with Jordanian Foreign Minister Nasser Judeh that he had spoken with Russian Foreign Minister Sergei Lavrov three times to secure a cessation of hostilities that could begin in the coming days.

Kerry provided no details, and he acknowledged that a way to enforce the agreement still hadnt been determined.

U.S. President Barack Obama and Russian President Putin also have yet to sign off on the terms, but Kerry said he expects the two leaders to speak somewhere in the next days or so in order to try to complete this task.

RELATED: Clinic in Syria destroyed by airstrike, Doctors Without Borders says

Syrian President Bashar al-Assad said Saturday that he was definitely ready to accept a cessation of hostility  but only if terrorists werent allowed to use it to their advantage.

We announced that were ready, Assad told the Spanish newspaper El Pais.

If you want to say cease-fire, its not the correct word, because a cease-fire is between two armies or two countries, Assad said. Its better to say cessation of hostility, or lets say, stopping the operations. ...

Its also about other complimentary and more important factors  preventing the terrorists from using the cease-fire or the cessation of hostility to improve their position, he said. Its about preventing other countries, especially Turkey, from sending more recruits, more terrorists, more armaments or any kind of logistical support to those terrorists.

Turkey has been among the most active of the Western countries supporting insurgents fighting Assads regime.

This article originally appeared on NBCNews.com.","['syrias', 'kerry', 'terrorists', 'announces', 'hostility', 'ceasefire', 'killed', 'ready', 'say', 'bombings', 'president', 'cessation', '129', 'truce', 'syrian', 'provisional']"
msnbc,2016-02-22 08:09:00,FBI fires back at Apple: 'We don't want to break anyone's encryption',"['Alex Johnson', 'Andrew Blankstein']","The war of words between Apple Inc. and the government continued Sunday as FBI Director James Comey said forcing Apple to help unlock the iPhone of one of the San Bernardino shooters is no big deal.

We dont want to break anyones encryption or set a master key loose on the land, Comey said in a statement Sunday night, insisting that vital decisions involving safety from terrorists shouldnt be left in the hands of corporations that sell stuff for a living.

A federal judge last week ordered Apple to help investigators gain access to encrypted data on the iPhone 5c used by Syed Rizwan Farook, who with his wife, Tashfeen Malik, killed 14 people in San Bernardino, California, on Dec. 2.

Not even Apple can decrypt the encrypted iPhone, according to the company. What investigators want it to do is help them figure out Farooks password so they can simply unlock the phone  but they fear that it has a common feature that wipes the data completely after a certain number of failed password entries.

Apple said it wouldnt comply, arguing that helping the government unlock an encrypted phone would sabotage the entire point of encryption and endanger the privacy of millions of its customers.

Since then, the company and federal authorities have lobbed strongly worded statements at each other. Heres how the battle has played out:

WEDNESDAY : Apple Chief Executive Tim Cook says the order would force the company to build a backdoor to the iPhone and that no reasonable person would find that acceptable.

: Apple Chief Executive Tim Cook says the order would force the company to build a backdoor to the iPhone and that no reasonable person would find that acceptable. THURSDAY: Google Chief Executive Sundar Pichai weighs in on Apples side, tweeting that helping the FBI try to get into the Farooks phone would sabotage the security of tens of millions of American citizens.

FRIDAY : Republican presidential front-runner Donald Trump adds his 2 cents worth, calling for a boycott of Apple unless it helps the FBI.

: Republican presidential front-runner Donald Trump adds his 2 cents worth, calling for a boycott of Apple unless it helps the FBI. FRIDAY : Prosecutors file a motion seeking to force Apples compliance, writing in court documents that Apple shouldnt be allowed to design and market its products to allow technology, rather than the law, to control access to data found by a court to be important to an critical investigation.

: Prosecutors file a motion seeking to force Apples compliance, writing in court documents that Apple shouldnt be allowed to design and market its products to allow technology, rather than the law, to control access to data found by a court to be important to an critical investigation. SATURDAY: The FBI lays out in a statement more detail on why it needs Apples help. It says that investigators were able to gain access to data Farook backed up to his iCloud account  but that Farook stopped backing up his phone in October, well before the December shootings. Since the iCloud backup does not contain everything on an iPhone, they said, investigators objective was, and still is, to extract as much evidence as possible from the phone.

SUNDAY: Comey tries to downplay the dispute, arguing in his new statement that no precedent would be set if Apple would just go along.

I hope folks will take a deep breath and stop saying the world is ending, but instead use that breath to talk to each other, he said.

Although this case is about the innocents attacked in San Bernardino, it does highlight that we have awesome new technology that creates a serious tension between two values we all treasure  privacy and safety, he said, adding:

We simply want the chance, with a search warrant, to try to guess the terrorists passcode without the phone essentially self-destructing and without it taking a decade to guess correctly.

This article originally appeared on NBCNews.com.","['force', 'apple', 'encryption', 'company', 'help', 'break', 'phone', 'fires', 'iphone', 'anyones', 'court', 'fbi', 'investigators', 'data', 'dont']"
msnbc,,Bernie Sanders: Flint water crisis 'ugly and terrible and...,"['All In With Chris Hayes', 'Andrea Mitchell Reports', 'Msnbc Live With Thomas Roberts', 'Msnbc Live', 'Weekends With Alex Witt', 'The Rachel Maddow Show', 'Msnbc Live With Tamron Hall', 'Morning Joe']","At a rally in Ypsilanti, Michigan on Monday, Bernie Sanders sounded off on the Flint, Michigan water crisis, saying it's ""beyond my comprehension that in 2016...we are poisoning our children.""

... more

Duration: {{video.duration.momentjs}}","['sanders', 'ypsilanti', 'sounded', 'saying', 'michigan', 'moreduration', 'terrible', 'poisoning', 'water', 'ugly', 'flint', 'videodurationmomentjs', 'rally', 'crisis', 'bernie']"
